Symbol,Name,Last Sale,Net Change,% Change,Market Cap,Country,IPO Year,Volume,Sector,Industry
QRHC,Quest Resource Holding Corporation Common Stock,$2.99,0.11,3.819%,54959869.00,United States,,28808,Technology,Diversified Commercial Services
QRTEA,Qurate Retail Inc. Series A Common Stock ,$11.60,-0.08,-0.685%,4760787726.00,United States,,4470881,Consumer Services,Catalog/Specialty Distribution
QRTEB,Qurate Retail Inc. Series B Common Stock ,$11.2301,-0.4199,-3.604%,4608976055.00,United States,,694,Consumer Services,Catalog/Specialty Distribution
QRTEP,Qurate Retail Inc. 8.0% Fixed Rate Cumulative Redeemable Preferred Stock,$99.79,0.66,0.666%,0.00,United States,,33426,Consumer Services,Catalog/Specialty Distribution
QRVO,Qorvo Inc. Common Stock,$171.42,6.08,3.677%,19415493234.00,United States,,1610245,Technology,Semiconductors
QTNT,Quotient Limited Ordinary Shares,$3.79,-0.125,-3.193%,383295029.00,Switzerland,2014,1573323,Health Care,Biotechnology: In Vitro & In Vivo Diagnostic Substances
QTRX,Quanterix Corporation Common Stock,$67.37,4.19,6.632%,2144814158.00,United States,2017,727235,Capital Goods,Biotechnology: Laboratory Analytical Instruments
QTT,Qutoutiao Inc. American Depositary Shares,$2.46,-0.37,-13.074%,656392088.00,China,2018,13395822,Technology,Computer Software: Programming Data Processing
QUIK,QuickLogic Corporation Common Stock,$6.91,0.59,9.335%,76483190.00,United States,1999,403522,Technology,Semiconductors
QUMU,Qumu Corporation Common Stock,$8.07,0.20,2.541%,141548438.00,United States,,104380,Technology,Computer Software: Prepackaged Software
QURE,uniQure N.V. Ordinary Shares,$32.48,-0.47,-1.426%,1461404698.00,Netherlands,2014,625331,Health Care,Major Pharmaceuticals
RAAC,Revolution Acceleration Acquisition Corp Class A Common Stock,$10.84,0.41,3.931%,415533330.00,United States,2021,1148143,Finance,Business Services
RAACU,Revolution Acceleration Acquisition Corp Unit,$11.42,0.45,4.102%,0.00,United States,2020,33205,Finance,Business Services
RAACW,Revolution Acceleration Acquisition Corp Warrant,$1.85,0.0669,3.752%,0.00,United States,2021,390788,Finance,Business Services
RACA,Therapeutics Acquisition Corp. Class A Common Stock,$13.89,1.04,8.093%,242156871.00,United States,2020,31272,Finance,Business Services
RADA,RADA Electronic Industries Ltd. Ordinary Shares,$11.50,-0.77,-6.275%,500078248.00,Israel,,1264574,Technology,Electronic Components
RADI,Radius Global Infrastructure Inc. Class A Common Stock,$11.26,0.36,3.303%,685727480.00,United States,,316243,Consumer Services,Real Estate
RAIL,FreightCar America Inc. Common Stock,$3.05,-0.01,-0.327%,47381228.00,United States,2005,242829,Capital Goods,Railroads
RAND,Rand Capital Corporation Common Stock,$16.1593,-0.2407,-1.468%,41751947.00,United States,,3582,Finance,Finance: Consumer Services
RAPT,RAPT Therapeutics Inc. Common Stock,$16.91,0.91,5.688%,415229430.00,United States,2019,170593,Health Care,Major Pharmaceuticals
RARE,Ultragenyx Pharmaceutical Inc. Common Stock,$118.50,-0.13,-0.11%,7933485414.00,United States,2014,525045,Health Care,Major Pharmaceuticals
RAVE,Rave Restaurant Group Inc. Common Stock,$1.14,0.045,4.11%,20525591.00,United States,,537751,Consumer Non-Durables,Food Distributors
RAVN,Raven Industries Inc. Common Stock,$37.88,0.02,0.053%,1358141376.00,United States,,332310,Capital Goods,Specialty Chemicals
RBB,RBB Bancorp Common Stock,$20.82,0.24,1.166%,407362475.00,United States,2017,60480,Finance,Major Banks
RBBN,Ribbon Communications Inc. Common Stock,$8.005,0.095,1.201%,1165183297.00,United States,,1225559,Technology,EDP Services
RBCAA,Republic Bancorp Inc. Class A Common Stock,$43.93,0.83,1.926%,918623481.00,United States,1998,41933,Finance,Major Banks
RBCN,Rubicon Technology Inc. Common Stock,$9.67,-0.3299,-3.299%,23419019.00,United States,2007,6981,Technology,Semiconductors
RBKB,Rhinebeck Bancorp Inc. Common Stock,$10.29,-0.1515,-1.451%,114561554.00,United States,2019,16450,Finance,Banks
RBNC,Reliant Bancorp Inc. Common Stock,$24.46,0.76,3.207%,407366844.00,United States,,52511,Finance,Major Banks
RCEL,Avita Therapeutics Inc. Common Stock,$19.71,-2.17,-9.918%,426300356.00,Australia,,437463,Health Care,Medical/Dental Instruments
RCHG,Recharge Acquisition Corp. Class A Common Stock,$10.00,0.07,0.705%,257500000.00,United States,2020,78366,Finance,Business Services
RCHGU,Recharge Acquisition Corp. Unit,$10.3401,-0.0599,-0.576%,0.00,United States,2020,1102,Finance,Business Services
RCHGW,Recharge Acquisition Corp. Warrant,$0.9801,0.1301,15.306%,0.00,United States,2020,109830,Finance,Business Services
RCII,Rent-A-Center Inc. Common Stock,$54.83,1.21,2.257%,2983504103.00,United States,1995,907726,Technology,Diversified Commercial Services
RCKT,Rocket Pharmaceuticals Inc. Common Stock,$52.42,2.36,4.714%,3175241063.00,United States,2015,458004,Health Care,Major Pharmaceuticals
RCKY,Rocky Brands Inc. Common Stock,$44.67,0.13,0.292%,323751677.00,United States,1993,125286,Consumer Non-Durables,Shoe Manufacturing
RCLFU,Rosecliff Acquisition Corp I Unit,$10.12,0.12,1.20%,0.00,United States,2021,563703,Finance,Business Services
RCM,R1 RCM Inc. Common Stock,$25.22,-0.06,-0.237%,6584089993.00,United States,,2066922,Consumer Services,Other Consumer Services
RCMT,RCM Technologies Inc. Common Stock,$3.60,0.14,4.046%,43034148.00,United States,,217509,Technology,Professional Services
RCON,Recon Technology Ltd. Ordinary Shares,$2.36,0.16,7.273%,16998684.00,China,2009,725026,Energy,Oilfield Services/Equipment
RDCM,Radcom Ltd. Ordinary Shares,$9.79,0.03,0.307%,136508392.00,Israel,1997,18138,Technology,Computer peripheral equipment
RDFN,Redfin Corporation Common Stock,$62.07,-3.79,-5.755%,6406023358.00,United States,2017,4141397,Finance,Real Estate
RDHL,Redhill Biopharma Ltd. American Depositary Shares,$7.83,0.33,4.40%,325625599.00,Israel,,640289,Health Care,Major Pharmaceuticals
RDI,Reading International Inc Class A Common Stock,$6.90,-0.12,-1.709%,150069459.00,United States,,180054,Consumer Services,Movies/Entertainment
RDIB,Reading International Inc Class B Common Stock,$20.00,0.00,0.00%,434983940.00,United States,,125,Consumer Services,Movies/Entertainment
RDNT,RadNet Inc. Common Stock,$18.92,0.57,3.106%,976954993.00,United States,,209050,Health Care,Medical Specialities
RDUS,Radius Health Inc. Common Stock,$21.47,0.76,3.67%,1006823391.00,United States,2014,675190,Health Care,Major Pharmaceuticals
RDVT,Red Violet Inc. Common Stock ,$20.45,-0.42,-2.012%,248468216.00,United States,,92984,Technology,Computer Software: Prepackaged Software
RDWR,Radware Ltd. Ordinary Shares,$26.01,0.86,3.419%,1200626230.00,Israel,1999,312177,Miscellaneous,Business Services
REAL,The RealReal Inc. Common Stock,$22.01,-0.23,-1.034%,1965529625.00,United States,2019,3662953,Consumer Services,Other Specialty Stores
REDU,RISE Education Cayman Ltd American Depositary Shares,$5.73,-0.02,-0.348%,323046863.00,China,2017,26456,Consumer Services,Other Consumer Services
REED,Reeds Inc. Common Stock,$1.01,0.01,1.00%,84336612.00,United States,,475244,Consumer Non-Durables,Beverages (Production/Distribution)
REFR,Research Frontiers Incorporated Common Stock,$3.64,-0.04,-1.087%,114935861.00,United States,,191038,Miscellaneous,Multi-Sector Companies
REG,Regency Centers Corporation Common Stock,$57.68,1.40,2.488%,9795734009.00,United States,1993,1303675,Consumer Services,Real Estate Investment Trusts
REGI,Renewable Energy Group Inc. Common Stock,$76.27,2.41,3.263%,2999906478.00,United States,2012,1505937,Basic Industries,Major Chemicals
REGN,Regeneron Pharmaceuticals Inc. Common Stock,$461.57,12.19,2.713%,49448870621.00,United States,1991,1223229,Health Care,Major Pharmaceuticals
REKR,Rekor Systems Inc. Common Stock,$13.27,0.42,3.268%,528731287.00,United States,,1376058,Capital Goods,Telecommunications Equipment
RELI,Reliance Global Group Inc. Common Stock,$4.20,-0.30,-6.667%,1498318702.00,United States,,194984,Finance,Specialty Insurers
RELIW,Reliance Global Group Inc. Series A Warrants,$0.9339,-0.2161,-18.791%,0.00,United States,,1193,Finance,Specialty Insurers
RELL,Richardson Electronics Ltd. Common Stock,$6.32,0.23,3.777%,83472373.00,United States,1983,109811,Technology,Electronic Components
REPH,Recro Pharma Inc. Common Stock,$3.275,-0.355,-9.78%,84649092.00,United States,2014,865270,Health Care,Major Pharmaceuticals
REPL,Replimune Group Inc. Common Stock,$35.31,3.01,9.319%,1641684320.00,United States,2018,723890,Health Care,Biotechnology: Biological Products (No Diagnostic Substances)
RESN,Resonant Inc. Common Stock,$4.17,0.04,0.969%,225914616.00,United States,2014,2612502,Technology,Semiconductors
RETA,Reata Pharmaceuticals Inc. Class A Common Stock,$126.92,1.97,1.577%,4583811117.00,United States,2016,234051,Health Care,Major Pharmaceuticals
RETO,ReTo Eco-Solutions Inc. Common Shares,$1.74,-0.31,-15.122%,41994900.00,China,2017,6241718,Capital Goods,Industrial Machinery/Components
REYN,Reynolds Consumer Products Inc. Common Stock,$27.97,0.54,1.969%,5865322985.00,United States,2020,594658,Consumer Durables,Containers/Packaging
RFIL,RF Industries Ltd. Common Stock,$5.79,0.00,0.00%,57021344.00,United States,,42845,Capital Goods,Electrical Products
RGCO,RGC Resources Inc. Common Stock,$23.30,0.15,0.648%,191419729.00,United States,,17575,Public Utilities,Oil & Gas Production
RGEN,Repligen Corporation Common Stock,$186.19,2.98,1.627%,10197876353.00,United States,1986,572870,Health Care,Biotechnology: Biological Products (No Diagnostic Substances)
RGLD,Royal Gold Inc. Common Stock,$104.74,0.95,0.915%,6871624391.00,United States,,333276,Basic Industries,Precious Metals
RGLS,Regulus Therapeutics Inc. Common Stock,$1.30,0.15,13.043%,86971251.00,United States,2012,2054553,Health Care,Major Pharmaceuticals
RGNX,REGENXBIO Inc. Common Stock,$39.93,0.72,1.836%,1692033750.00,United States,2015,421520,Health Care,Biotechnology: Biological Products (No Diagnostic Substances)
RGP,Resources Connection Inc. Common Stock,$13.865,0.445,3.316%,450727649.00,United States,,202203,Miscellaneous,Business Services
RIBT,RiceBran Technologies Common Stock,$0.9124,0.0475,5.492%,41275231.00,United States,,744690,Consumer Non-Durables,Packaged Foods
RICK,RCI Hospitality Holdings Inc. Common Stock,$65.20,0.10,0.154%,586794132.00,United States,1995,136767,Consumer Services,Restaurants
RIDE,Lordstown Motors Corp. Class A Common Stock,$16.77,-1.02,-5.734%,2766193439.00,United States,2019,10060419,Capital Goods,Auto Manufacturing
RIGL,Rigel Pharmaceuticals Inc. Common Stock,$3.84,0.26,7.263%,648888707.00,United States,2000,6050883,Health Care,Major Pharmaceuticals
RILY,B. Riley Financial Inc. Common Stock,$56.65,-5.63,-9.04%,1520747723.00,United States,,767904,Miscellaneous,Business Services
RILYG,B. Riley Financial Inc. 7.25% Senior Notes due 2027,$25.42,0.00,0.00%,0.00,United States,,8708,Miscellaneous,Business Services
RILYH,B. Riley Financial Inc. 7.375% Senior Notes due 2023,$25.7863,-0.0137,-0.053%,0.00,United States,,8865,Miscellaneous,Business Services
RILYI,B. Riley Financial Inc. 6.875% Senior Notes due 2023,$25.74,0.01,0.039%,0.00,United States,,9374,Miscellaneous,Business Services
RILYL,B. Riley Financial Inc. Depositary Shares each representing 1/1000th in a share of 7.375% Series B Cumulative Perpetual Preferred Stock par value $0.0001,$27.00,-0.1438,-0.53%,0.00,United States,,2107,Miscellaneous,Business Services
RILYM,B. Riley Financial Inc. 6.375% Senior Notes due 2025,$25.40,0.1025,0.405%,0.00,United States,,31357,Miscellaneous,Business Services
RILYN,B. Riley Financial Inc. 6.50% Senior Notes Due 2026,$26.10,0.07,0.269%,0.00,United States,,10683,Miscellaneous,Business Services
RILYO,B. Riley Financial Inc. 6.75% Senior Notes due 2024,$25.89,-0.05,-0.193%,0.00,United States,,2987,Miscellaneous,Business Services
RILYP,B. Riley Financial Inc. Depositary Shares each representing a 1/1000th fractional interest in a share of Series A Cumulative Perpetual Preferred Stock,$26.75,0.14,0.526%,0.00,United States,,21036,Miscellaneous,Business Services
RILYT,B. Riley Financial Inc. 6.00% Senior Notes Due 2028,$25.40,-0.15,-0.587%,0.00,United States,,18889,Miscellaneous,Business Services
RILYZ,B. Riley Financial Inc. 7.50% Senior Notes Due 2027,$25.2932,-0.0068,-0.027%,0.00,United States,,42956,Miscellaneous,Business Services
RIOT,Riot Blockchain Inc.  Common Stock ,$40.30,-3.99,-9.009%,2721455252.00,United States,,27563805,Technology,EDP Services
RIVE,Riverview Financial Corporation Common Stock,$9.70,0.36,3.854%,90272487.00,United States,,6663,Finance,Major Banks
RKDA,Arcadia Biosciences Inc. Common Stock,$2.69,-0.02,-0.738%,57371365.00,United States,2015,1021152,Consumer Non-Durables,Farming/Seeds/Milling
RLAY,Relay Therapeutics Inc. Common Stock,$37.39,-2.60,-6.502%,3364530737.00,United States,2020,1199983,Health Care,Biotechnology: Biological Products (No Diagnostic Substances)
RLMD,Relmada Therapeutics Inc. Common Stock,$34.23,1.01,3.04%,555947435.00,United States,,81053,Health Care,Major Pharmaceuticals
RMBI,Richmond Mutual Bancorporation Inc. Common Stock,$13.84,0.14,1.022%,182040205.00,United States,2019,26902,Finance,Major Banks
RMBL,RumbleOn Inc. Class B Common Stock,$31.74,-0.72,-2.218%,71149431.00,United States,,49223,Technology,EDP Services
RMBS,Rambus Inc. Common Stock,$19.64,0.30,1.551%,2194383819.00,United States,1997,1425565,Technology,Semiconductors
RMCF,Rocky Mountain Chocolate Factory Inc. Common Stock,$4.94,0.33,7.158%,30007007.00,United States,,31800,Consumer Non-Durables,Specialty Foods
RMGB,RMG Acquisition Corp. II Class A Ordinary Shares,$10.51,0.26,2.537%,453243750.00,United States,2021,1208891,Finance,Business Services
RMGBU,RMG Acquisition Corp. II Unit,$10.92,0.07,0.645%,0.00,United States,2020,209475,Finance,Business Services
RMGBW,RMG Acquisition Corp. II Warrant,$1.48,0.12,8.824%,0.00,United States,2021,442897,Finance,Business Services
RMGCU,RMG Acquisition Corp. III Unit,$10.32,0.24,2.381%,0.00,United States,2021,592611,Finance,Business Services
RMNI,Rimini Street Inc. (DE) Common Stock,$8.09,-2.05,-20.217%,617145650.00,United States,2015,2449353,Miscellaneous,Business Services
RMR,The RMR Group Inc. Class A Common Stock,$42.33,0.78,1.877%,1328977484.00,United States,,85924,Consumer Services,Professional Services
RMRM,RMR Mortgage Trust Common Stock,$12.00,-0.045,-0.374%,122424108.00,United States,,25607,,
RMTI,Rockwell Medical Inc. (DE) Common Stock,$1.24,0.01,0.813%,116030725.00,United States,1998,1915394,Health Care,Major Pharmaceuticals
RNA,Avidity Biosciences Inc. Common Stock,$22.96,-0.83,-3.489%,861611448.00,United States,2020,530905,Health Care,Major Pharmaceuticals
RNDB,Randolph Bancorp Inc. Common Stock,$20.34,-0.21,-1.022%,112348437.00,United States,2016,11267,Finance,Major Banks
RNET,RigNet Inc. Common Stock,$8.90,-0.14,-1.549%,186998870.00,United States,2010,437965,Consumer Services,Telecommunications Equipment
RNLX,Renalytix AI plc American Depositary Shares,$26.54,0.94,3.672%,955833243.00,United Kingdom,2020,303663,Health Care,Medical Specialities
RNST,Renasant Corporation Common Stock,$42.08,1.16,2.835%,2366518436.00,United States,,333458,Finance,Major Banks
RNWK,RealNetworks Inc. Common Stock,$3.78,-0.49,-11.475%,144682758.00,United States,1997,1848797,Technology,EDP Services
ROAD,Construction Partners Inc. Class A Common Stock,$28.71,0.12,0.42%,1486940999.00,United States,2018,284887,Basic Industries,Military/Government/Technical
ROCC,Roth CH Acquisition II Co. Common Stock,$10.17,0.19,1.904%,148990500.00,United States,2021,364986,Finance,Business Services
ROCCU,Roth CH Acquisition II Co. Unit,$10.88,0.52,5.019%,0.00,United States,2020,142981,Finance,Business Services
ROCCW,Roth CH Acquisition II Co. Warrant,$1.45,0.07,5.072%,0.00,United States,2021,138844,Finance,Business Services
ROCH,Roth CH Acquisition I Co. Common Stock,$20.51,1.27,6.601%,201572280.00,United States,2020,358250,Finance,Business Services
ROCHU,Roth CH Acquisition I Co. Unit,$26.17,2.68,11.409%,0.00,United States,2020,661,Finance,Business Services
ROCHW,Roth CH Acquisition I Co. Warrant,$8.202,0.622,8.206%,0.00,United States,2020,76240,Finance,Business Services
ROCK,Gibraltar Industries Inc. Common Stock,$81.42,1.15,1.433%,2651927645.00,United States,1993,217518,Capital Goods,Steel/Iron Ore
ROCRU,Roth CH Acquisition III Co. Unit,$10.0793,0.0693,0.692%,0.00,United States,2021,202062,,
ROIC,Retail Opportunity Investments Corp. Common Stock (MD),$16.27,0.18,1.119%,1921873949.00,United States,,736325,Consumer Services,Real Estate Investment Trusts
ROKU,Roku Inc. Class A Common Stock,$353.54,-6.41,-1.781%,45402294435.00,United States,2017,7946267,Consumer Services,Television Services
ROLL,RBC Bearings Incorporated Common Stock,$194.83,2.14,1.111%,4897955087.00,United States,2005,167128,Capital Goods,Metal Fabrications
ROOT,Root Inc. Class A Common Stock,$12.95,-0.49,-3.646%,3258220000.00,United States,2020,2279486,Finance,Property-Casualty Insurers
ROST,Ross Stores Inc. Common Stock,$113.13,1.11,0.991%,40326670729.00,United States,1985,3789523,Consumer Services,Clothing/Shoe/Accessory Stores
RP,RealPage Inc. Common Stock,$86.92,0.03,0.035%,8873795440.00,United States,2010,1681218,Technology,Computer Software: Prepackaged Software
RPAY,Repay Holdings Corporation Class A Common Stock,$22.96,-0.79,-3.326%,1838471190.00,United States,2018,1939623,Miscellaneous,Business Services
RPD,Rapid7 Inc. Common Stock,$77.78,-1.07,-1.357%,4098031572.00,United States,2015,821988,Technology,Computer Software: Prepackaged Software
RPRX,Royalty Pharma plc Class A Ordinary Shares ,$42.54,0.20,0.472%,25826496410.00,United States,2020,3439577,Health Care,Major Pharmaceuticals
RPTX,Repare Therapeutics Inc. Common Shares,$27.25,-0.17,-0.62%,1001846604.00,Canada,2020,250828,Health Care,Major Pharmaceuticals
RRBI,Red River Bancshares Inc. Common Stock,$59.20,2.70,4.779%,433659714.00,United States,2019,22562,Finance,Major Banks
RRGB,Red Robin Gourmet Burgers Inc. Common Stock,$36.21,2.27,6.688%,562770425.00,United States,2002,567940,Consumer Services,Restaurants
RRR,Red Rock Resorts Inc. Class A Common Stock,$30.75,0.19,0.622%,3607404639.00,United States,2016,839447,Consumer Services,Hotels/Resorts
RSSS,Research Solutions Inc Common Stock,$2.05,0.04,1.99%,53869242.00,United States,,174915,Miscellaneous,Business Services
RSVA,Rodgers Silicon Valley Acquisition Corp. Common Stock,$14.39,-0.49,-3.293%,413712500.00,United States,2021,551758,Finance,Business Services
RSVAU,Rodgers Silicon Valley Acquisition Corp. Unit,$17.14,-0.11,-0.638%,0.00,United States,2020,56752,Finance,Business Services
RSVAW,Rodgers Silicon Valley Acquisition Corp. Warrant,$4.85,0.10,2.105%,0.00,United States,2021,107593,Finance,Business Services
RTLR,Rattler Midstream LP Common Units,$10.95,0.11,1.015%,1636227610.00,United States,2019,338623,Public Utilities,Natural Gas Distribution
RUBY,Rubius Therapeutics Inc. Common Stock,$12.56,2.16,20.769%,1019645568.00,United States,2018,2992944,Health Care,Biotechnology: Biological Products (No Diagnostic Substances)
RUHN,Ruhnn Holding Limited American Depositary Shares,$3.40,-0.01,-0.293%,281027082.00,China,2019,144390,Consumer Services,Catalog/Specialty Distribution
RUN,Sunrun Inc. Common Stock,$52.47,-0.95,-1.778%,10629565322.00,United States,2015,8658404,Capital Goods,Industrial Specialties
RUSHA,Rush Enterprises Inc. Common Stock Cl A,$45.45,1.84,4.219%,2503143252.00,United States,,245393,Consumer Durables,Automotive Aftermarket
RUSHB,Rush Enterprises Inc. Class B,$41.09,2.06,5.278%,2263017738.00,United States,,14431,Consumer Durables,Automotive Aftermarket
RUTH,Ruth's Hospitality Group Inc. Common Stock,$24.01,1.38,6.098%,837942925.00,United States,2005,658245,Consumer Services,Restaurants
RVMD,Revolution Medicines Inc. Common Stock,$45.50,3.05,7.185%,3323631948.00,United States,2020,606065,Health Care,Biotechnology: Biological Products (No Diagnostic Substances)
RVNC,Revance Therapeutics Inc. Common Stock,$26.29,0.58,2.256%,1836334784.00,United States,2014,514134,Health Care,Major Pharmaceuticals
RVPH,Reviva Pharmaceuticals Holdings Inc. Common Stock ,$7.83,-0.40,-4.86%,40203550.00,United States,2020,39396,Health Care,Major Pharmaceuticals
RVPHW,Reviva Pharmaceuticals Holdings Inc. Warrants,$0.522,-0.0082,-1.547%,0.00,United States,2018,28410,Health Care,Major Pharmaceuticals
RVSB,Riverview Bancorp Inc Common Stock,$7.36,0.22,3.081%,164460930.00,United States,,139936,Finance,Savings Institutions
RWLK,ReWalk Robotics Ltd. Ordinary Shares,$2.71,-0.12,-4.24%,90637180.00,Israel,2014,3349247,Health Care,Industrial Specialties
RXRAU,RXR Acquisition Corp. Units,$10.00,0.15,1.523%,0.00,United States,2021,2129538,,
RXT,Rackspace Technology Inc. Common Stock,$20.04,-0.40,-1.957%,4067310584.00,United States,2020,1731494,Technology,Computer Software: Programming Data Processing
RYAAY,Ryanair Holdings plc American Depositary Shares,$107.02,-2.64,-2.407%,24136370963.00,Ireland,1997,375742,Transportation,Air Freight/Delivery Services
RYTM,Rhythm Pharmaceuticals Inc. Common Stock,$25.98,0.48,1.882%,1303706641.00,United States,2017,553716,Health Care,Major Pharmaceuticals
RZLT,Rezolute Inc. Common Stock,$9.0027,-0.5583,-5.839%,75193044.00,United States,,3261,Health Care,Major Pharmaceuticals
SABR,Sabre Corporation Common Stock,$15.05,-0.26,-1.698%,4775784338.00,United States,2014,13301168,Technology,Computer Software: Programming Data Processing
SABRP,Sabre Corporation 6.50% Series A Mandatory Convertible Preferred Stock,$187.38,-5.38,-2.791%,,United States,,107044,Technology,Computer Software: Programming Data Processing
SAFM,Sanderson Farms Inc. Common Stock,$161.02,1.15,0.719%,3595640042.00,United States,1987,273271,Consumer Non-Durables,Meat/Poultry/Fish
SAFT,Safety Insurance Group Inc. Common Stock,$83.35,1.61,1.97%,1241389728.00,United States,2002,113013,Finance,Property-Casualty Insurers
SAGE,Sage Therapeutics Inc. Common Stock,$76.98,6.33,8.96%,4494241202.00,United States,2014,641343,Health Care,Major Pharmaceuticals
SAIA,Saia Inc. Common Stock,$205.24,-3.72,-1.78%,5403905370.00,United States,,366960,Transportation,Trucking Freight/Courier Services
SAII,Software Acquisition Group Inc. II Class A Common Stock,$10.32,0.18,1.775%,222525000.00,United States,2020,868698,Finance,Business Services
SAIIU,Software Acquisition Group Inc. II Unit,$10.89,0.31,2.93%,0.00,United States,2020,43921,Finance,Business Services
SAIIW,Software Acquisition Group Inc. II Warrant,$1.49,0.199,15.414%,0.00,United States,2020,199142,Finance,Business Services
SAL,Salisbury Bancorp Inc. Common Stock,$44.60,0.01,0.022%,126810823.00,United States,,13022,Finance,Savings Institutions
SALM,Salem Media Group Inc. Class A Common Stock,$2.70,0.22,8.871%,72045080.00,United States,1999,1063333,Consumer Services,Broadcasting
SAMG,Silvercrest Asset Management Group Inc. Class A Common Stock,$15.00,0.18,1.215%,215585070.00,United States,2013,53508,Finance,Investment Managers
SANA,Sana Biotechnology Inc. Common Stock,$23.90,0.86,3.733%,4477420646.00,United States,2021,820707,Health Care,Biotechnology: Biological Products (No Diagnostic Substances)
SANM,Sanmina Corporation Common Stock,$38.12,0.86,2.308%,2475000810.00,United States,1993,507606,Technology,Electrical Products
SANW,S&W Seed Company Common Stock (NV),$3.46,-0.14,-3.889%,121374534.00,United States,,108476,Consumer Non-Durables,Farming/Seeds/Milling
SASR,Sandy Spring Bancorp Inc. Common Stock,$40.09,1.35,3.485%,1888071945.00,United States,,174830,Finance,Major Banks
SATS,EchoStar  Corporation Common Stock,$26.64,0.33,1.254%,2496129958.00,United States,,709698,Consumer Services,Telecommunications Equipment
SAVA,Cassava Sciences Inc. Common Stock,$43.41,-1.07,-2.406%,1694522633.00,United States,,4060567,Health Care,Major Pharmaceuticals
SBAC,SBA Communications Corporation Class A Common Stock,$242.19,6.27,2.658%,26475968610.00,United States,1999,1214710,Consumer Services,Real Estate Investment Trusts
SBBP,Strongbridge Biopharma plc Ordinary Shares,$2.78,0.01,0.361%,186937686.00,United States,2015,1220023,Health Care,Major Pharmaceuticals
SBCF,Seacoast Banking Corporation of Florida Common Stock,$38.12,0.97,2.611%,2105863160.00,United States,,398109,Finance,Major Banks
SBEAU,SilverBox Engaged Merger Corp I Units,$10.03,0.03,0.30%,0.00,United States,2021,651143,Finance,Business Services
SBFG,SB Financial Group Inc. Common Stock,$19.44,0.00,0.00%,143197003.00,United States,,36461,Finance,Major Banks
SBGI,Sinclair Broadcast Group Inc. Class A Common Stock,$36.41,0.75,2.103%,2693632918.00,United States,1995,672796,Consumer Services,Broadcasting
SBLK,Star Bulk Carriers Corp. Common Shares,$13.60,0.10,0.741%,1349660138.00,Greece,,1411954,Transportation,Marine Transportation
SBLKZ,Star Bulk Carriers Corp. 8.30% Senior Notes due 2022,$25.50,-0.19,-0.74%,0.00,Greece,,658,Transportation,Marine Transportation
SBNY,Signature Bank Common Stock,$222.62,5.96,2.751%,11925604467.00,United States,2004,957836,Finance,Major Banks
SBNYP,Signature Bank Depositary shares each representing a 1/40th ownership interest in a share of 5.000% Noncumulative Perpetual Series A Preferred Stock,$25.13,-0.05,-0.199%,0.00,United States,,80878,Finance,Major Banks
SBRA,Sabra Health Care REIT Inc. Common Stock,$18.11,0.53,3.015%,3816136375.00,United States,,2392906,Consumer Services,Real Estate Investment Trusts
SBSI,Southside Bancshares Inc. Common Stock,$38.49,1.31,3.523%,1260838138.00,United States,,257705,Finance,Major Banks
SBT,Sterling Bancorp Inc. Common Stock,$5.47,0.20,3.795%,273400780.00,United States,2017,48415,Finance,Savings Institutions
SBTX,Silverback Therapeutics Inc. Common Stock,$44.03,-2.23,-4.821%,1531878947.00,United States,2020,342914,Health Care,Major Pharmaceuticals
SBUX,Starbucks Corporation Common Stock,$105.20,0.31,0.296%,123851960000.00,United States,1992,5558707,Consumer Services,Restaurants
SCHL,Scholastic Corporation Common Stock,$29.55,0.41,1.407%,1013600194.00,United States,1992,235188,Consumer Services,Books
