Symbol,Name,Last Sale,Net Change,% Change,Market Cap,Country,IPO Year,Volume,Sector,Industry
CVGI,Commercial Vehicle Group Inc. Common Stock,$9.56,0.19,2.028%,294787370.00,United States,2004,341648,Capital Goods,Auto Parts:O.E.M.
CVGW,Calavo Growers Inc. Common Stock,$82.82,4.46,5.692%,1465070727.00,United States,,106487,Consumer Non-Durables,Farming/Seeds/Milling
CVLG,Covenant Logistics Group Inc. Class A Common Stock,$19.66,0.39,2.024%,336858647.00,United States,,84678,Transportation,Trucking Freight/Courier Services
CVLT,Commvault Systems Inc. Common Stock,$62.27,2.12,3.525%,2926541548.00,United States,2006,365061,Technology,Computer Software: Prepackaged Software
CVLY,Codorus Valley Bancorp Inc Common Stock,$18.80,1.10,6.215%,184634800.00,United States,,23934,Finance,Savings Institutions
CVV,CVD Equipment Corporation Common Stock,$4.07,-0.28,-6.437%,27059387.00,United States,,166513,Technology,Industrial Machinery/Components
CWBC,Community West Bancshares Common Stock,$10.45,0.00,0.00%,88543508.00,United States,,1680,Finance,Major Banks
CWBR,CohBar Inc. Common Stock,$1.38,0.00,0.00%,84342183.00,United States,,495221,Health Care,Major Pharmaceuticals
CWCO,Consolidated Water Co. Ltd. Ordinary Shares,$13.67,0.32,2.397%,206731068.00,Cayman Islands,,110089,Public Utilities,Water Supply
CWST,Casella Waste Systems Inc. Class A Common Stock,$62.28,0.86,1.40%,3181857236.00,United States,1997,417664,Public Utilities,Environmental Services
CXDC,China XD Plastics Company Limited Common Stock,$1.10,0.02,1.852%,77603725.00,China,,298778,Capital Goods,Containers/Packaging
CXDO,Crexendo Inc. Common Stock,$6.28,0.32,5.369%,112809110.00,United States,,71655,Public Utilities,Telecommunications Equipment
CYAD,Celyad Oncology SA American Depositary Shares,$7.16,-0.21,-2.849%,101708917.00,Belgium,2015,55942,Health Care,Major Pharmaceuticals
CYAN,Cyanotech Corporation Common Stock,$3.64,0.09,2.535%,22193346.00,United States,,19756,Consumer Durables,Specialty Chemicals
CYBE,CyberOptics Corporation Common Stock,$26.31,0.49,1.898%,190870736.00,United States,1987,87935,Capital Goods,Electronic Components
CYBR,CyberArk Software Ltd. Ordinary Shares,$137.14,-2.58,-1.847%,5311619396.00,Israel,2014,691953,Technology,Computer Software: Prepackaged Software
CYCC,Cyclacel Pharmaceuticals Inc. Common Stock,$6.17,0.07,1.148%,30010781.00,United States,,315649,Health Care,Major Pharmaceuticals
CYCN,Cyclerion Therapeutics Inc. Common Stock,$3.59,-0.17,-4.521%,122256387.00,United States,,440217,Health Care,Major Pharmaceuticals
CYRN,CYREN Ltd. Ordinary Shares,$0.81,-0.0472,-5.506%,60537575.00,United States,,4275626,Technology,Computer Software: Prepackaged Software
CYRX,CryoPort Inc. Common Stock,$52.50,0.41,0.787%,2323271160.00,United States,,833505,Health Care,Major Pharmaceuticals
CYTH,Cyclo Therapeutics Inc. Common Stock,$7.46,-0.38,-4.847%,34128202.00,United States,,349402,Basic Industries,Major Chemicals
CYTHW,Cyclo Therapeutics Inc. Warrant,$2.85,-0.25,-8.065%,0.00,United States,,21030,Basic Industries,Major Chemicals
CYTK,Cytokinetics Incorporated Common Stock,$19.68,1.11,5.977%,1399456136.00,United States,2004,1912295,Health Care,Major Pharmaceuticals
CZNC,Citizens & Northern Corp Common Stock,$23.45,0.53,2.312%,373136025.00,United States,,58538,Finance,Major Banks
CZR,Caesars Entertainment Inc. Common Stock,$93.31,2.49,2.742%,19434367367.00,United States,,3143126,Consumer Services,Hotels/Resorts
CZWI,Citizens Community Bancorp Inc. Common Stock,$11.405,0.145,1.288%,126097660.00,United States,,3849,Finance,Savings Institutions
DADA,Dada Nexus Limited American Depositary Shares,$32.51,0.29,0.90%,7594568154.00,China,2020,1866145,Technology,Computer Software: Programming Data Processing
DAIO,Data I/O Corporation Common Stock,$4.96,0.21,4.421%,41745022.00,United States,1981,140714,Capital Goods,Electrical Products
DAKT,Daktronics Inc. Common Stock,$6.39,0.47,7.939%,287335175.00,United States,1994,547050,Consumer Durables,Miscellaneous manufacturing industries
DARE,Dare Bioscience Inc. Common Stock,$1.94,0.05,2.646%,80696731.00,United States,2014,3143193,Health Care,Major Pharmaceuticals
DBDR,Roman DBDR Tech Acquisition Corp. Class A Common Stock,$10.07,-0.04,-0.396%,291476150.00,United States,2020,33654,Finance,Business Services
DBDRU,Roman DBDR Tech Acquisition Corp. Unit,$10.50,-0.0075,-0.071%,0.00,United States,2020,4621,Finance,Business Services
DBDRW,Roman DBDR Tech Acquisition Corp. Warrant,$1.09,0.11,11.224%,0.00,United States,2020,92598,Finance,Business Services
DBTX,Decibel Therapeutics Inc. Common Stock,$14.68,-2.99,-16.921%,356747150.00,United States,2021,261771,Health Care,Major Pharmaceuticals
DBVT,DBV Technologies S.A. American Depositary Shares,$5.21,0.19,3.785%,571882809.00,France,2014,165749,Health Care,Biotechnology: Biological Products (No Diagnostic Substances)
DBX,Dropbox Inc. Class A Common Stock,$23.48,0.43,1.866%,9737554056.00,United States,2018,9116234,Technology,Computer Software: Prepackaged Software
DCBO,Docebo Inc. Common Shares,$40.42,-0.65,-1.583%,1321306276.00,Canada,,129756,Technology,Computer Software: Prepackaged Software
DCOM,Dime Community Bancshares Inc. Common Stock,$30.96,0.82,2.721%,1275552000.00,United States,,282855,Finance,Savings Institutions
DCOMP,Dime Community Bancshares Inc. Fixed-Rate Non-Cumulative Perpetual Preferred Stock Series A,$24.75,0.00,0.00%,0.00,United States,,7933,Finance,Savings Institutions
DCPH,Deciphera Pharmaceuticals Inc. Common Stock,$42.79,-0.17,-0.396%,2465814101.00,United States,2017,539301,Health Care,Major Pharmaceuticals
DCRB,Decarbonization Plus Acquisition Corporation Class A Common Stock,$11.35,0.38,3.464%,320247366.00,United States,2020,907709,Finance,Business Services
DCRBU,Decarbonization Plus Acquisition Corporation Unit,$12.26,0.25,2.082%,0.00,United States,2020,18645,Finance,Business Services
DCRBW,Decarbonization Plus Acquisition Corporation Warrant,$2.02,-0.16,-7.339%,0.00,United States,2020,361523,Finance,Business Services
DCRNU,Decarbonization Plus Acquisition Corporation II Unit,$10.26,0.10,0.984%,0.00,United States,2021,1229233,Finance,Business Services
DCT,Duck Creek Technologies Inc. Common Stock,$43.48,-1.01,-2.27%,5696952739.00,United States,2020,1083151,Technology,Computer Software: Prepackaged Software
DCTH,Delcath Systems Inc. Common Stock,$17.91,0.64,3.706%,111925088.00,United States,,122859,Health Care,Medical/Dental Instruments
DDMX,DD3 Acquisition Corp. II Class A Common Stock,$9.92,0.17,1.744%,71654144.00,Mexico,2021,91598,Finance,Business Services
DDMXU,DD3 Acquisition Corp. II Unit,$10.40,0.18,1.761%,0.00,Mexico,2020,10834,Finance,Business Services
DDMXW,DD3 Acquisition Corp. II Warrant,$1.12,0.12,12.00%,0.00,Mexico,2021,48979,Finance,Business Services
DDOG,Datadog Inc. Class A Common Stock,$82.20,-2.80,-3.294%,25193623905.00,United States,2019,8261920,Technology,Computer Software: Prepackaged Software
DENN,Denny's Corporation Common Stock,$17.79,0.21,1.195%,1134434855.00,United States,,629541,Consumer Services,Restaurants
DFFN,Diffusion Pharmaceuticals Inc. Common Stock,$0.895,-0.0012,-0.134%,91000998.00,United States,,5453510,Health Care,Major Pharmaceuticals
DFH,Dream Finders Homes Inc. Class A Common Stock,$21.56,-1.64,-7.069%,1994763152.00,United States,2021,377094,Capital Goods,Homebuilding
DFHT,Deerfield Healthcare Technology Acquisitions Corp. Class A Common Stock,$11.71,-0.68,-5.488%,210414063.00,United States,2020,562633,Health Care,Hospital/Nursing Management
DFHTU,Deerfield Healthcare Technology Acquisitions Corp. Unit,$11.75,-0.83,-6.598%,0.00,United States,2020,9780,Health Care,Hospital/Nursing Management
DFHTW,Deerfield Healthcare Technology Acquisitions Corp. Warrant,$1.98,-0.27,-12.00%,0.00,United States,2020,6496,Health Care,Hospital/Nursing Management
DFPH,DFP Healthcare Acquisitions Corp. Class A Common Stock,$10.20,0.05,0.493%,293250000.00,United States,2020,63233,Finance,Business Services
DFPHU,DFP Healthcare Acquisitions Corp. Unit,$10.94,0.566,5.456%,0.00,United States,2020,7906,Finance,Business Services
DFPHW,DFP Healthcare Acquisitions Corp. Warrant,$1.65,0.22,15.385%,0.00,United States,2020,58407,Finance,Business Services
DGICA,Donegal Group Inc. Class A Common Stock,$14.57,0.22,1.533%,433777530.00,United States,,94852,Finance,Property-Casualty Insurers
DGICB,Donegal Group Inc. Class B Common Stock,$13.2392,0.2392,1.84%,394156999.00,United States,1986,281,Finance,Property-Casualty Insurers
DGII,Digi International Inc. Common Stock,$17.77,0.05,0.282%,527934368.00,United States,1989,963972,Technology,Computer Communications Equipment
DGLY,Digital Ally Inc. Common Stock,$1.74,0.04,2.353%,70419872.00,United States,,5498079,Technology,Radio And Television Broadcasting And Communications Equipment
DGNS,Dragoneer Growth Opportunities Corp. II Class A Ordinary Shares,$10.98,0.27,2.521%,346748400.00,United States,2020,235255,Finance,Business Services
DHBCU,DHB Capital Corp. Unit,$10.05,0.039,0.39%,0.00,United States,2021,870869,Finance,Business Services
DHC,Diversified Healthcare Trust Common Shares of Beneficial Interest,$4.80,0.21,4.575%,1143688694.00,United States,,1397993,Consumer Services,Real Estate Investment Trusts
DHCAU,DHC Acquisition Corp. Unit,$10.01,0.02,0.20%,0.00,United States,2021,1090136,Finance,Business Services
DHCNI,Diversified Healthcare Trust 5.625% Senior Notes due 2042,$21.48,0.59,2.824%,0.00,United States,,30783,Consumer Services,Real Estate Investment Trusts
DHCNL,Diversified Healthcare Trust 6.25% Senior Notes Due 2046,$23.02,-0.0099,-0.043%,0.00,United States,,22978,Consumer Services,Real Estate Investment Trusts
DHHCU,DiamondHead Holdings Corp. Unit,$10.24,0.09,0.887%,0.00,United States,2021,113298,Finance,Business Services
DHIL,Diamond Hill Investment Group Inc. Class A Common Stock,$156.70,5.93,3.933%,495237657.00,United States,,21574,Finance,Investment Managers
DIOD,Diodes Incorporated Common Stock,$76.82,3.70,5.06%,3401845564.00,United States,,482561,Technology,Semiconductors
DISCA,Discovery Inc. Series A Common Stock,$64.25,1.65,2.636%,31311222029.00,United States,,9083220,Consumer Services,Television Services
DISCB,Discovery Inc. Series B Common Stock,$68.07,-1.93,-2.757%,33172838654.00,United States,,4287,Consumer Services,Television Services
DISCK,Discovery Inc. Series C Common Stock,$53.00,1.56,3.033%,25828712335.00,United States,,10176075,Consumer Services,Television Services
DISH,DISH Network Corporation Class A Common Stock,$33.81,1.03,3.142%,17789812772.00,United States,1995,4211504,Consumer Services,Television Services
DJCO,Daily Journal Corp. (S.C.) Common Stock,$332.51,-8.04,-2.361%,459111852.00,United States,,4394,Consumer Services,Newspapers/Magazines
DKNG,DraftKings Inc. Class A Common Stock,$59.52,-2.39,-3.86%,23671105905.00,United States,2019,25821032,Consumer Services,Services-Misc. Amusement & Recreation
DLCAU,Deep Lake Capital Acquisition Corp. Unit,$10.28,0.21,2.085%,0.00,United States,2021,328309,Finance,Business Services
DLHC,DLH Holdings Corp.,$9.84,-0.43,-4.187%,123432035.00,United States,,35294,Technology,Professional Services
DLPN,Dolphin Entertainment Inc. Common Stock,$4.08,0.01,0.246%,26766195.00,United States,,84813,Consumer Services,Other Consumer Services
DLTH,Duluth Holdings Inc. Class B Common Stock,$14.35,0.22,1.557%,471084613.00,United States,2015,169201,Consumer Services,Clothing/Shoe/Accessory Stores
DLTR,Dollar Tree Inc. Common Stock,$104.08,2.27,2.23%,24478799180.00,United States,1995,2406479,Consumer Services,Department/Specialty Retail Stores
DMAC,DiaMedica Therapeutics Inc. Common Stock,$8.60,-0.05,-0.578%,161156036.00,United States,2018,210892,Health Care,Major Pharmaceuticals
DMLP,Dorchester Minerals L.P. Common Units Representing Limited Partnership Interests,$14.89,0.30,2.056%,516381835.00,United States,,73544,Energy,Oil & Gas Production
DMRC,Digimarc Corporation Common Stock,$31.97,0.33,1.043%,527946953.00,United States,,450402,Technology,EDP Services
DMTK,DermTech Inc. Common Stock,$48.70,-4.28,-8.079%,1237952977.00,United States,2017,3836294,Health Care,Medical Specialities
DNLI,Denali Therapeutics Inc. Common Stock,$61.04,2.34,3.986%,7384868548.00,United States,2017,643072,Health Care,Biotechnology: Biological Products (No Diagnostic Substances)
DOCU,DocuSign Inc. Common Stock,$204.31,-6.31,-2.996%,39075700917.00,United States,2018,6780551,Technology,Computer Software: Prepackaged Software
DOGZ,Dogness (International) Corporation Class A Common Stock,$1.60,-0.05,-3.03%,46990018.00,China,2017,1021935,Consumer Durables,Miscellaneous manufacturing industries
DOMO,Domo Inc. Class B Common Stock,$56.49,0.59,1.055%,1691834093.00,United States,2018,731207,Technology,Computer Software: Prepackaged Software
DOOO,BRP Inc. (Recreational Products) Common Subordinate Voting Shares,$73.28,2.52,3.561%,6442787126.00,Canada,,54460,Capital Goods,Industrial Specialties
DORM,Dorman Products Inc. Common Stock,$106.59,1.66,1.582%,3429751866.00,United States,,199130,Capital Goods,Auto Parts:O.E.M.
DOX,Amdocs Limited Ordinary Shares,$77.27,0.93,1.218%,10108847750.00,Guernsey,,1225523,Technology,EDP Services
DOYU,DouYu International Holdings Limited ADS,$14.70,0.97,7.065%,4717914285.00,China,2019,4103788,Technology,Computer Software: Programming Data Processing
DRIO,DarioHealth Corp. Common Stock,$21.88,-2.50,-10.254%,319404240.00,Israel,,691169,Health Care,Medical/Dental Instruments
DRIOW,DarioHealth Corp.,$0.119,-0.0285,-19.322%,0.00,Israel,,47289,Health Care,Medical/Dental Instruments
DRNA,Dicerna Pharmaceuticals Inc. Common Stock,$27.40,0.34,1.256%,2091192468.00,United States,2014,1076049,Health Care,Major Pharmaceuticals
DRRX,DURECT Corporation Common Stock,$2.05,0.02,0.985%,460204033.00,United States,2000,2315683,Health Care,Major Pharmaceuticals
DRTT,DIRTT Environmental Solutions Ltd. Common Shares,$2.82,0.32,12.80%,238801446.00,Canada,,355780,Technology,Computer Software: Prepackaged Software
DRVN,Driven Brands Holdings Inc. Common Stock,$27.56,0.33,1.212%,4613826573.00,United States,2021,612474,Consumer Services,Automotive Aftermarket
DSAC,Duddell Street Acquisition Corp. Class A Ordinary Shares,$10.05,0.15,1.515%,219843750.00,Hong Kong,2020,79566,Finance,Business Services
DSACU,Duddell Street Acquisition Corp. Unit,$10.75,0.05,0.467%,0.00,Hong Kong,2020,4191,Finance,Business Services
DSACW,Duddell Street Acquisition Corp. Warrant,$2.14,-0.01,-0.465%,0.00,Hong Kong,2020,10796,Finance,Business Services
DSGX,Descartes Systems Group Inc. (The) Common Stock,$58.79,-1.82,-3.003%,4966813478.00,Canada,,200312,Technology,Computer Software: Prepackaged Software
DSKE,Daseke Inc. Common Stock,$6.06,0.32,5.575%,394074710.00,United States,2015,657594,Consumer Services,Transportation Services
DSKEW,Daseke Inc. Warrant,$0.1781,-0.0006,-0.336%,0.00,United States,2015,135491,Consumer Services,Transportation Services
DSP,Viant Technology Inc. Class A Common Stock,$41.32,-0.77,-1.829%,2435217298.00,United States,2021,808873,Technology,Computer Software: Programming Data Processing
DSPG,DSP Group Inc. Common Stock,$15.27,0.52,3.525%,360327702.00,United States,1994,141307,Technology,Semiconductors
DSWL,Deswell Industries Inc. Common Shares,$3.5636,-0.0014,-0.039%,56715546.00,Macau,1995,32861,Consumer Non-Durables,Plastic Products
DTEA,DAVIDsTEA Inc. Common Stock,$3.57,0.09,2.586%,93644338.00,Canada,2015,344817,Consumer Non-Durables,Food Chains
DTIL,Precision BioSciences Inc. Common Stock,$11.50,0.48,4.356%,646790579.00,United States,2019,920289,Health Care,Biotechnology: Biological Products (No Diagnostic Substances)
DTSS,Datasea Inc. Common Stock,$3.02,0.04,1.342%,64840747.00,China,,50478,Technology,Computer Software: Prepackaged Software
DUNE,Dune Acquisition Corporation Class A Common Stock,$9.88,0.03,0.305%,,United States,2021,122786,Finance,Business Services
DUNEU,Dune Acquisition Corporation Unit,$10.30,0.09,0.881%,0.00,United States,2020,178351,Finance,Business Services
DUNEW,Dune Acquisition Corporation Warrant,$0.90,0.07,8.434%,0.00,United States,2021,162286,Finance,Business Services
DUO,Fangdd Network Group Ltd. American Depositary Shares,$6.78,0.27,4.147%,541361060.00,China,2019,116233,Finance,Real Estate
DUOT,Duos Technologies Group Inc. Common Stock,$6.36,0.13,2.087%,22476335.00,United States,,24284,Technology,Computer Software: Prepackaged Software
DVAX,Dynavax Technologies Corporation Common Stock,$8.225,-0.245,-2.893%,931531431.00,United States,2004,5190595,Health Care,Major Pharmaceuticals
DWSN,Dawson Geophysical Company Common Stock,$2.95,0.02,0.683%,69260312.00,United States,,76060,Energy,Oil & Gas Production
DXCM,DexCom Inc. Common Stock,$364.09,7.82,2.195%,35017216095.00,United States,2005,792377,Health Care,Medical/Dental Instruments
DXPE,DXP Enterprises Inc. Common Stock,$32.25,1.46,4.742%,573750623.00,United States,,122124,Capital Goods,Industrial Machinery/Components
DXYN,Dixie Group Inc. (The) Common Stock,$2.94,-0.30,-9.259%,46492237.00,United States,,1075832,Consumer Durables,Home Furnishings
DYAI,Dyadic International Inc. Common Stock,$4.95,0.01,0.202%,136036677.00,United States,,146258,Health Care,Biotechnology: Biological Products (No Diagnostic Substances)
DYN,Dyne Therapeutics Inc. Common Stock,$15.60,-0.10,-0.637%,802571687.00,United States,2020,515053,Health Care,Major Pharmaceuticals
DYNT,Dynatronics Corporation Common Stock,$1.07,0.03,2.885%,16022724.00,United States,,769213,Health Care,Medical/Dental Instruments
DZSI,DZS Inc. Common Stock,$15.37,-0.41,-2.598%,408194447.00,United States,,159750,Public Utilities,Telecommunications Equipment
EA,Electronic Arts Inc. Common Stock,$132.60,1.31,0.998%,38139211180.00,United States,,2511029,Technology,Computer Software: Prepackaged Software
EAC,Edify Acquisition Corp. Class A Common Stock,$9.80,-0.05,-0.508%,338100000.00,United States,2021,113917,Finance,Business Services
EACPU,Edify Acquisition Corp. Units,$10.05,0.04,0.40%,0.00,United States,2021,166940,Finance,Business Services
EACPW,Edify Acquisition Corp. Warrant,$0.61,0.1089,21.732%,0.00,United States,2021,268710,Finance,Business Services
EAR,Eargo Inc. Common Stock,$55.67,1.61,2.978%,2129188278.00,United States,2020,265971,Health Care,Industrial Specialties
EARS,Auris Medical Holding Ltd. Common Shares 0.01 SF (Bermuda),$3.16,0.35,12.456%,22402858.00,Bermuda,2014,18675924,Health Care,Major Pharmaceuticals
EAST,Eastside Distilling Inc. Common Stock,$1.63,-0.01,-0.61%,18499281.00,United States,,137543,Consumer Non-Durables,Beverages (Production/Distribution)
EBAY,eBay Inc. Common Stock,$53.76,0.42,0.787%,36580764434.00,United States,1998,8394970,Miscellaneous,Business Services
EBC,Eastern Bankshares Inc. Common Stock,$17.92,0.04,0.224%,3346706120.00,United States,2020,848065,Finance,Savings Institutions
EBIX,Ebix Inc. Common Stock,$24.85,0.50,2.053%,769419591.00,United States,,809520,Technology,EDP Services
EBMT,Eagle Bancorp Montana Inc. Common Stock,$25.27,1.27,5.292%,171215546.00,United States,,49160,Finance,Major Banks
EBON,Ebang International Holdings Inc. Class A Ordinary Shares,$6.16,0.27,4.584%,856457676.00,China,2020,13640965,Technology,Semiconductors
EBSB,Meridian Bancorp Inc. Common Stock,$18.25,0.47,2.643%,956574863.00,United States,,190850,Finance,Major Banks
EBTC,Enterprise Bancorp Inc Common Stock,$32.19,1.28,4.141%,384277621.00,United States,,26720,Finance,Major Banks
ECHO,Echo Global Logistics Inc. Common Stock,$29.46,0.72,2.505%,783871356.00,United States,2009,131158,Transportation,Oil Refining/Marketing
ECOL,US Ecology Inc Common Stock,$40.94,1.99,5.109%,1289591004.00,United States,,173726,Public Utilities,Environmental Services
ECOLW,US Ecology Inc. Warrant,$9.00,0.00,0.00%,0.00,United States,,11,Public Utilities,Environmental Services
ECOR,electroCore Inc. Common Stock,$2.02,0.06,3.061%,91818003.00,United States,2018,1993290,Health Care,Biotechnology: Electromedical & Electrotherapeutic Apparatus
ECPG,Encore Capital Group Inc Common Stock,$38.06,1.34,3.649%,1193012356.00,United States,,752505,Finance,Finance Companies
EDAP,EDAP TMS S.A. American Depositary Shares,$7.41,0.09,1.23%,215939004.00,France,1997,239349,Health Care,Biotechnology: Electromedical & Electrotherapeutic Apparatus
EDIT,Editas Medicine Inc. Common Stock,$41.63,1.27,3.147%,2804312989.00,United States,2016,3829961,Health Care,Biotechnology: Biological Products (No Diagnostic Substances)
EDRY,EuroDry Ltd. Common Shares ,$6.94,0.32,4.834%,15994132.00,Greece,,33591,Consumer Services,Marine Transportation
EDSA,Edesa Biotech Inc. Common Shares,$5.11,0.13,2.61%,56460288.00,United States,,279342,Health Care,Major Pharmaceuticals
EDTK,Skillful Craftsman Education Technology Limited Ordinary Share,$3.13,0.055,1.789%,37560000.00,China,2020,272787,Consumer Services,Other Consumer Services
EDTX,EdtechX Holdings Acquisition Corp. II Class A common stock,$9.83,-0.09,-0.907%,77718438.00,United Kingdom,2021,66465,Finance,Business Services
EDTXU,EdtechX Holdings Acquisition Corp. II Unit,$10.25,0.15,1.485%,147343750.00,United Kingdom,2020,93995,Finance,Business Services
EDTXW,EdtechX Holdings Acquisition Corp. II Warrant,$0.95,0.13,15.854%,0.00,United Kingdom,2021,107027,Finance,Business Services
EDUC,Educational Development Corporation Common Stock,$15.96,-0.05,-0.312%,133281513.00,United States,,31423,Consumer Durables,Consumer Specialties
EEFT,Euronet Worldwide Inc. Common Stock,$164.67,11.88,7.775%,8686811974.00,United States,1997,622759,Finance,Investment Bankers/Brokers/Service
EFOI,Energy Focus Inc. Common Stock,$4.27,-0.22,-4.90%,17891326.00,United States,,425453,Consumer Durables,Building Products
EFSC,Enterprise Financial Services Corporation Common Stock,$46.11,1.47,3.293%,1439795309.00,United States,,270518,Finance,Major Banks
EGAN,eGain Corporation Common Stock,$9.96,0.01,0.101%,309307959.00,United States,1999,454108,Technology,Computer Software: Prepackaged Software
EGBN,Eagle Bancorp Inc. Common Stock,$52.08,1.13,2.218%,1655084849.00,United States,,142391,Finance,Major Banks
EGLE,Eagle Bulk Shipping Inc. Common Stock,$33.52,2.32,7.436%,416583610.00,United States,,180412,Transportation,Marine Transportation
EGOV,NIC Inc Common Stock,$34.21,-0.07,-0.204%,2298669041.00,United States,1999,1439805,Miscellaneous,Business Services
EGRX,Eagle Pharmaceuticals Inc. Common Stock,$43.25,1.44,3.444%,563553123.00,United States,2014,255362,Health Care,Major Pharmaceuticals
EH,EHang Holdings Limited ADS,$34.67,-1.37,-3.801%,1897441186.00,China,2019,4020115,Capital Goods,Military/Government/Technical
EHTH,eHealth Inc. Common Stock,$53.00,0.92,1.767%,1374427429.00,United States,2006,1056746,Finance,Specialty Insurers
EIGR,Eiger BioPharmaceuticals Inc. Common Stock,$9.08,-0.16,-1.732%,295387772.00,United States,2014,363237,Health Care,Biotechnology: Biological Products (No Diagnostic Substances)
EJFAU,EJF Acquisition Corp. Unit,$10.03,0.02,0.20%,0.00,United States,2021,1044503,Finance,Business Services
EKSO,Ekso Bionics Holdings Inc. Common Stock,$5.87,-0.05,-0.845%,73961413.00,United States,,331531,Capital Goods,Industrial Machinery/Components
ELDN,Eledon Pharmaceuticals Inc. Common Stock,$13.90,-0.23,-1.628%,198861935.00,United States,2014,69682,Health Care,Major Pharmaceuticals
ELOX,Eloxx Pharmaceuticals Inc. Common Stock,$3.61,-0.16,-4.244%,144951908.00,United States,,104791,Health Care,Biotechnology: Commercial Physical & Biological Resarch
ELSE,Electro-Sensors Inc. Common Stock,$4.55,-0.11,-2.361%,15449621.00,United States,,43260,Capital Goods,Industrial Machinery/Components
ELTK,Eltek Ltd. Ordinary Shares,$5.28,0.16,3.125%,23127815.00,Israel,1997,35963,Technology,Electrical Products
ELYS,Elys Game Technology Corp. Common Stock,$5.17,-0.36,-6.51%,86158562.00,Canada,,1405815,Technology,Computer Software: Prepackaged Software
EMCF,Emclaire Financial Corp Common Stock,$29.342,0.00,0.00%,79845803.00,United States,,345,Finance,Major Banks
EMKR,EMCORE Corporation Common Stock,$6.26,0.02,0.321%,228101542.00,United States,1997,1273757,Technology,Semiconductors
EML,Eastern Company (The) Common Stock,$26.98,0.36,1.352%,168433766.00,United States,,15999,Capital Goods,Industrial Machinery/Components
ENDP,Endo International plc Ordinary Shares,$6.99,0.10,1.451%,1611199467.00,Ireland,,4859027,Health Care,Major Pharmaceuticals
ENFAU,890 5th Avenue Partners Inc. Unit,$10.33,0.32,3.197%,0.00,United States,2021,486216,Finance,Business Services
ENG,ENGlobal Corporation Common Stock,$4.31,0.30,7.481%,118754232.00,United States,,1819884,Consumer Services,Military/Government/Technical
ENLV,Enlivex Therapeutics Ltd. Ordinary Shares,$12.99,-0.01,-0.077%,174894385.00,Israel,2014,246656,Health Care,Major Pharmaceuticals
ENNVU,ECP Environmental Growth Opportunities Corp. Unit,$10.31,0.22,2.18%,0.00,United States,2021,318675,Finance,Business Services
ENOB,Enochian Biosciences Inc. Common Stock,$3.77,-0.16,-4.071%,176231689.00,United States,,191827,Health Care,Major Pharmaceuticals
ENPH,Enphase Energy Inc. Common Stock,$143.55,-6.33,-4.223%,19207359928.00,United States,2012,6611303,Technology,Semiconductors
ENSG,The Ensign Group Inc. Common Stock,$80.85,-1.69,-2.047%,4422144273.00,United States,2007,371376,Health Care,Hospital/Nursing Management
ENTA,Enanta Pharmaceuticals Inc. Common Stock,$51.44,1.60,3.21%,1037640067.00,United States,2013,159997,Health Care,Major Pharmaceuticals
ENTG,Entegris Inc. Common Stock,$100.32,3.10,3.189%,13536536946.00,United States,2000,931864,Consumer Non-Durables,Plastic Products
ENTX,Entera Bio Ltd. Ordinary Shares,$1.41,0.05,3.676%,25710209.00,Israel,2018,233447,Health Care,Biotechnology: Biological Products (No Diagnostic Substances)
ENTXW,Entera Bio Ltd. Warrant,$0.1855,-0.0095,-4.872%,0.00,Israel,2018,15542,Health Care,Biotechnology: Biological Products (No Diagnostic Substances)
ENVB,Enveric Biosciences Inc. Common Stock,$2.78,-0.15,-5.119%,50975125.00,United States,,1141345,Technology,Semiconductors
ENVIU,Environmental Impact Acquisition Corp. Unit,$10.25,0.14,1.385%,0.00,United States,2021,456819,Finance,Business Services
