Symbol,Name,Last Sale,Net Change,% Change,Market Cap,Country,IPO Year,Volume,Sector,Industry
KALA,Kala Pharmaceuticals Inc. Common Stock,$7.12,0.03,0.423%,399146239.00,United States,2017,3444233,Health Care,Major Pharmaceuticals
KALU,Kaiser Aluminum Corporation Common Stock,$114.61,3.16,2.835%,1812232689.00,United States,,94481,Capital Goods,Metal Fabrications
KALV,KalVista Pharmaceuticals Inc. Common Stock,$30.88,-0.68,-2.155%,744931086.00,United Kingdom,2015,594605,Health Care,Major Pharmaceuticals
KBAL,Kimball International Inc. Class B Common Stock,$13.40,0.04,0.299%,494217621.00,United States,,292576,Consumer Durables,Home Furnishings
KBNT,Kubient Inc. Common Stock,$6.26,-0.34,-5.152%,73593242.00,United States,2020,1469038,Technology,EDP Services
KBNTW,Kubient Inc. Warrant,$2.48,0.04,1.639%,0.00,United States,2020,115520,Technology,EDP Services
KBSF,KBS Fashion Group Limited Common Stock,$3.09,-0.22,-6.647%,8007114.00,China,2013,65216,Consumer Non-Durables,Apparel
KC,Kingsoft Cloud Holdings Limited American Depositary Shares,$52.33,-1.06,-1.985%,11408869695.00,China,2020,2097016,Technology,Computer Software: Prepackaged Software
KCAPL,KCAP Financial Inc. 6.125% Notes due 2022,$25.53,0.00,0.00%,0.00,United States,,800,,
KDMN,Kadmon Holdings Inc. Common Stock,$4.61,-0.04,-0.86%,790674676.00,United States,,4445577,Health Care,Major Pharmaceuticals
KDNY,Chinook Therapeutics Inc. Common Stock,$17.31,0.31,1.824%,729762458.00,United States,2015,227374,Health Care,Major Pharmaceuticals
KDP,Keurig Dr Pepper Inc. Common Stock,$31.53,0.65,2.105%,44371137086.00,United States,,5867269,Consumer Non-Durables,Beverages (Production/Distribution)
KE,Kimball Electronics Inc. Common Stock,$25.16,0.96,3.967%,627919655.00,United States,,119101,Technology,Electrical Products
KELYA,Kelly Services Inc. Class A Common Stock,$22.00,0.20,0.917%,864635222.00,United States,,352134,Technology,Professional Services
KELYB,Kelly Services Inc. Class B Common Stock,$21.3301,0.2901,1.379%,838307079.00,United States,,1451,Technology,Professional Services
KEQU,Kewaunee Scientific Corporation Common Stock,$12.38,-0.18,-1.433%,34203427.00,United States,,463,Capital Goods,Medical Specialities
KERN,Akerna Corp. Common Stock,$4.51,-0.07,-1.528%,63404769.00,United States,2018,1333000,Technology,EDP Services
KERNW,Akerna Corp Warrant,$1.57,0.03,1.948%,0.00,United States,2018,63568,Technology,EDP Services
KFFB,Kentucky First Federal Bancorp Common Stock,$7.25,-0.02,-0.275%,59770559.00,United States,,3312,Finance,Savings Institutions
KFRC,Kforce Inc. Common Stock,$52.63,0.60,1.153%,1162440336.00,United States,1995,166617,Technology,Professional Services
KHC,The Kraft Heinz Company Common Stock,$37.85,0.64,1.72%,46297202024.00,United States,,7562668,Consumer Non-Durables,Packaged Foods
KIDS,OrthoPediatrics Corp. Common Stock,$47.75,-1.16,-2.372%,933733153.00,United States,2017,232353,Health Care,Medical/Dental Instruments
KIIIU,Kismet Acquisition Three Corp. Unit,$10.00,0.00,0.00%,0.00,United States,2021,325292,Finance,Business Services
KIN,Kindred Biosciences Inc. Common Stock,$4.78,0.39,8.884%,188772401.00,United States,2013,957643,Health Care,Major Pharmaceuticals
KINS,Kingstone Companies Inc. Common Stock,$7.17,-0.15,-2.049%,76541170.00,United States,,11471,Finance,Property-Casualty Insurers
KINZ,KINS Technology Group Inc. Class A Common Stock,$9.95,0.00,0.00%,343275000.00,United States,2021,284412,Finance,Business Services
KINZU,KINS Technology Group Inc. Unit,$10.29,0.02,0.195%,0.00,United States,2020,288759,Finance,Business Services
KINZW,KINS Technology Group Inc. Warrant,$1.1194,0.2894,34.867%,0.00,United States,2021,403383,Finance,Business Services
KIRK,Kirkland's Inc. COMMONSTOCK,$23.81,-0.48,-1.976%,339425741.00,United States,2002,1163441,Consumer Services,Other Specialty Stores
KLAC,KLA Corporation Common Stock,$295.87,8.25,2.868%,45586066991.00,United States,1980,1631124,Capital Goods,Electronic Components
KLAQ,KL Acquisition Corp Class A Common Stock,$9.80,0.0899,0.926%,0.00,United States,2021,1485,Finance,Business Services
KLAQU,KL Acquisition Corp Unit,$10.12,0.03,0.297%,0.00,United States,2021,410425,Finance,Business Services
KLAQW,KL Acquisition Corp Warrant,$0.9299,-0.12,-11.43%,0.00,United States,2021,26760,Finance,Business Services
KLDO,Kaleido Biosciences Inc. Common Stock,$8.81,-0.36,-3.926%,368552316.00,United States,2019,312265,Health Care,Biotechnology: Biological Products (No Diagnostic Substances)
KLIC,Kulicke and Soffa Industries Inc. Common Stock,$44.11,-0.62,-1.386%,2738215897.00,Singapore,,1255886,Technology,Semiconductors
KLXE,KLX Energy Services Holdings Inc. Common Stock,$13.29,0.17,1.296%,113099468.00,United States,,289330,Energy,Oilfield Services/Equipment
KMDA,Kamada Ltd. Ordinary Shares,$6.10,0.08,1.329%,272946720.00,Israel,2013,175958,Health Care,Major Pharmaceuticals
KMPH,KemPharm Inc. Common Stock,$10.05,0.42,4.361%,189442329.00,United States,,5201653,Health Care,Major Pharmaceuticals
KNDI,Kandi Technologies Group Inc Common Stock,$6.10,-0.13,-2.087%,441503086.00,China,,5086362,Capital Goods,Auto Manufacturing
KNSA,Kiniksa Pharmaceuticals Ltd. Class A Common Stock,$22.37,0.47,2.146%,1526356640.00,United States,2018,696989,Health Care,Major Pharmaceuticals
KNSL,Kinsale Capital Group Inc. Common Stock,$162.57,4.78,3.029%,3702228394.00,United States,2016,222496,Finance,Property-Casualty Insurers
KNTE,Kinnate Biopharma Inc. Common Stock,$32.26,2.56,8.62%,1397736085.00,United States,2020,964424,Health Care,Major Pharmaceuticals
KOD,Kodiak Sciences Inc Common Stock,$120.49,8.82,7.898%,6164560468.00,United States,2018,334600,Health Care,Biotechnology: Biological Products (No Diagnostic Substances)
KOPN,Kopin Corporation Common Stock,$8.26,0.17,2.101%,722362110.00,United States,1992,13182997,Technology,Semiconductors
KOR,Corvus Gold Inc. Common Shares,$1.77,0.00,0.00%,224140136.00,Canada,,98557,Basic Industries,Precious Metals
KOSS,Koss Corporation Common Stock,$14.78,-0.52,-3.399%,124083613.00,United States,,1895032,Consumer Non-Durables,Consumer Electronics/Appliances
KPTI,Karyopharm Therapeutics Inc. Common Stock,$11.63,0.04,0.345%,867996804.00,United States,2013,2838293,Health Care,Major Pharmaceuticals
KRBP,Kiromic BioPharma Inc. Common Stock,$10.07,-0.78,-7.189%,73843300.00,United States,2020,46586,Health Care,Biotechnology: Biological Products (No Diagnostic Substances)
KRKR,36Kr Holdings Inc. American Depositary Shares,$3.53,0.00,0.00%,132355020.00,China,2019,364189,Miscellaneous,Business Services
KRMD,Repro Med Systems Inc. Common Stock,$3.71,0.21,6.00%,163028114.00,United States,,557468,Health Care,Medical/Dental Instruments
KRNLU,Kernel Group Holdings Inc. Units,$10.15,0.13,1.297%,0.00,United States,2021,230385,Finance,Business Services
KRNT,Kornit Digital Ltd. Ordinary Shares,$101.44,2.53,2.558%,4592993016.00,Israel,2015,276770,Capital Goods,Industrial Machinery/Components
KRNY,Kearny Financial Corp Common Stock,$12.42,0.51,4.282%,1045767242.00,United States,,606133,Finance,Savings Institutions
KRON,Kronos Bio Inc. Common Stock,$27.87,-1.45,-4.945%,1561653756.00,United States,2020,227655,Health Care,Major Pharmaceuticals
KROS,Keros Therapeutics Inc. Common Stock,$58.62,3.37,6.10%,1358714936.00,United States,2020,113380,Health Care,Major Pharmaceuticals
KRTX,Karuna Therapeutics Inc. Common Stock,$120.75,2.99,2.539%,3262512131.00,United States,2019,305671,Health Care,Major Pharmaceuticals
KRUS,Kura Sushi USA Inc. Class A Common Stock,$31.80,-0.46,-1.426%,266219615.00,United States,2019,91473,Consumer Services,Restaurants
KRYS,Krystal Biotech Inc. Common Stock,$72.74,1.09,1.521%,1613493803.00,United States,2017,219142,Health Care,Biotechnology: Biological Products (No Diagnostic Substances)
KSMT,Kismet Acquisition One Corp Ordinary Shares,$9.96,0.04,0.403%,316230000.00,Russia,2020,222908,Finance,Business Services
KSMTU,Kismet Acquisition One Corp Unit,$10.45,0.02,0.192%,0.00,Russia,2020,4745,Finance,Business Services
KSMTW,Kismet Acquisition One Corp Warrant,$0.86,0.1095,14.59%,0.00,Russia,,60359,Finance,Business Services
KSPN,Kaspien Holdings Inc. Common Stock,$30.49,1.6996,5.903%,58729411.00,United States,,36040,Consumer Services,Consumer Electronics/Video Chains
KTCC,Key Tronic Corporation Common Stock,$8.03,0.01,0.125%,86400230.00,United States,1983,36265,Technology,Electrical Products
KTOS,Kratos Defense & Security Solutions Inc. Common Stock,$24.03,-1.06,-4.225%,2966818197.00,United States,,3312004,Capital Goods,Military/Government/Technical
KTRA,Kintara Therapeutics Inc. Common Stock,$1.85,0.14,8.187%,56658133.00,United States,,613001,Health Care,Major Pharmaceuticals
KURA,Kura Oncology Inc. Common Stock,$29.74,-1.28,-4.126%,1969121534.00,United States,,1246409,Health Care,Major Pharmaceuticals
KVHI,KVH Industries Inc. Common Stock,$13.355,-0.285,-2.089%,244432011.00,United States,1996,148536,Technology,Radio And Television Broadcasting And Communications Equipment
KVSA,Khosla Ventures Acquisition Co. Class A Common Stock,$10.70,0.45,4.39%,0.00,United States,2021,1163676,,
KXIN,Kaixin Auto Holdings Ordinary Share,$2.99,0.21,7.554%,194745126.00,China,2017,3496140,Consumer Durables,Automotive Aftermarket
KYMR,Kymera Therapeutics Inc. Common Stock,$48.18,2.32,5.059%,2142031777.00,United States,2020,208516,Health Care,Biotechnology: Biological Products (No Diagnostic Substances)
KZIA,Kazia Therapeutics Limited American Depositary Shares,$9.48,0.12,1.282%,119605614.00,Australia,,145908,Health Care,Major Pharmaceuticals
KZR,Kezar Life Sciences Inc. Common Stock,$5.83,0.23,4.107%,270512000.00,United States,2018,237732,Health Care,Major Pharmaceuticals
LABP,Landos Biopharma Inc. Common Stock,$12.42,-0.48,-3.721%,486406621.00,United States,2021,350188,Health Care,Major Pharmaceuticals
LACQ,Leisure Acquisition Corp. Common Stock,$15.43,2.23,16.894%,96040455.00,United States,2017,11052,Finance,Business Services
LACQU,Leisure Acquisition Corp. Unit,$15.20,1.40,10.145%,0.00,United States,2017,1213,Finance,Business Services
LACQW,Leisure Acquisition Corp. Warrant,$1.04,0.10,10.638%,0.00,United States,2017,123429,Finance,Business Services
LAKE,Lakeland Industries Inc. Common Stock,$29.15,0.06,0.206%,233782417.00,United States,1986,354133,Health Care,Industrial Specialties
LAMR,Lamar Advertising Company Class A Common Stock,$93.12,1.21,1.317%,9396900391.00,United States,1996,666310,Consumer Services,Real Estate Investment Trusts
LANC,Lancaster Colony Corporation Common Stock,$180.38,5.14,2.933%,4969288620.00,United States,,83371,Consumer Non-Durables,Packaged Foods
LAND,Gladstone Land Corporation Common Stock,$18.33,-0.13,-0.704%,490202251.00,United States,1993,291809,Consumer Services,Real Estate Investment Trusts
LANDM,Gladstone Land Corporation 5.00% Series D Cumulative Term Preferred Stock,$25.86,0.2117,0.825%,623288219.00,United States,,4273,Consumer Services,Real Estate Investment Trusts
LANDO,Gladstone Land Corporation 6.00% Series B Cumulative Redeemable Preferred Stock,$25.30,0.03,0.119%,0.00,United States,,30116,Consumer Services,Real Estate Investment Trusts
LARK,Landmark Bancorp Inc. Common Stock,$27.45,0.70,2.617%,130410503.00,United States,,14572,Finance,Major Banks
LASR,nLIGHT Inc. Common Stock,$33.75,-0.56,-1.632%,1328602196.00,United States,2018,572459,Technology,Semiconductors
LATN,Union Acquisition Corp. II Ordinary Shares,$10.08,0.09,0.901%,252000000.00,United States,2019,181037,Finance,Business Services
LATNU,Union Acquisition Corp. II Units containing one ordinary share and one redeemable warrant,$10.75,0.24,2.284%,0.00,United States,2019,2177,Finance,Business Services
LATNW,Union Acquisition Corp. II Warrant,$0.8449,0.0948,12.638%,0.00,United States,2019,309960,Finance,Business Services
LAUR,Laureate Education Inc. Class A Common Stock,$13.93,0.34,2.502%,2771516700.00,United States,2017,1248072,Consumer Services,Other Consumer Services
LAWS,Lawson Products Inc. Common Stock,$54.28,1.78,3.39%,491833197.00,United States,,12938,Consumer Durables,Industrial Specialties
LAZR,Luminar Technologies Inc.  Class A Common Stock,$22.93,-0.53,-2.259%,7427857983.00,United States,2019,7570654,Capital Goods,Auto Parts:O.E.M.
LAZRW,Luminar Technologies Inc. Warrant,$11.04,-0.70,-5.963%,0.00,United States,2019,112708,Capital Goods,Auto Parts:O.E.M.
LAZY,Lazydays Holdings Inc. Common Stock,$18.84,-0.32,-1.67%,178072873.00,United States,,222256,Consumer Durables,Automotive Aftermarket
LBAI,Lakeland Bancorp Inc. Common Stock,$17.31,0.63,3.777%,873802672.00,United States,,265521,Finance,Major Banks
LBC,Luther Burbank Corporation Common Stock,$11.47,0.26,2.319%,598966451.00,United States,2017,74278,Finance,Major Banks
LBRDA,Liberty Broadband Corporation Class A Common Stock,$148.45,3.54,2.443%,28995071555.00,United States,,169939,Consumer Services,Television Services
LBRDK,Liberty Broadband Corporation Class C Common Stock,$152.59,3.38,2.265%,29803691267.00,United States,,1439180,Consumer Services,Television Services
LBRDP,Liberty Broadband Corporation Series A Cumulative Redeemable Preferred Stock,$27.40,-0.13,-0.472%,0.00,United States,,29942,Public Utilities,Telecommunications Equipment
LBTYA,Liberty Global plc Class A Ordinary Shares,$23.88,0.125,0.526%,13788610930.00,United Kingdom,,1567543,,
LBTYB,Liberty Global plc Class B Ordinary Shares,$24.93,2.35,10.407%,14394894074.00,United Kingdom,,4720,Consumer Services,Television Services
LBTYK,Liberty Global plc Class C Ordinary Shares,$23.655,0.12,0.51%,13658693113.00,United Kingdom,,3671080,,
LCAP,Lionheart Acquisition Corp. II Class A Common Stock,$10.00,-0.02,-0.20%,294000000.00,United States,2020,224395,Finance,Business Services
LCAPU,Lionheart Acquisition Corp. II Unit,$10.38,-0.11,-1.049%,0.00,United States,2020,19736,Finance,Business Services
LCAPW,Lionheart Acquisition Corp. II Warrant,$1.05,0.17,19.318%,0.00,United States,2020,135802,Finance,Business Services
LCNB,LCNB Corporation Common Stock,$18.31,1.01,5.838%,235435931.00,United States,,125420,Finance,Major Banks
LCUT,Lifetime Brands Inc. Common Stock,$14.30,0.95,7.116%,311282686.00,United States,1991,97295,Capital Goods,Industrial Machinery/Components
LCY,Landcadia Holdings III Inc. Class A Common Stock,$10.14,0.10,0.996%,633750000.00,United States,2020,1451017,Technology,Computer Software: Prepackaged Software
LCYAU,Landcadia Holdings III Inc. Unit ,$10.38,0.01,0.096%,0.00,United States,2020,306803,Capital Goods,Industrial Machinery/Components
LCYAW,Landcadia Holdings III Inc. Warrant,$1.35,0.07,5.469%,0.00,United States,2020,220845,Capital Goods,Industrial Machinery/Components
LE,Lands' End Inc. Common Stock,$30.00,-0.87,-2.818%,978232710.00,United States,,222003,Consumer Services,Clothing/Shoe/Accessory Stores
LECO,Lincoln Electric Holdings Inc. Common Shares,$119.68,4.48,3.889%,7140352468.00,United States,,240041,Technology,Industrial Machinery/Components
LEDS,SemiLEDS Corporation Common Stock,$4.44,0.14,3.256%,17810274.00,Taiwan,2010,507426,Technology,Semiconductors
LEGH,Legacy Housing Corporation Common Stock (TX),$15.59,0.07,0.451%,377155728.00,United States,2018,29318,Basic Industries,Homebuilding
LEGN,Legend Biotech Corporation American Depositary Shares,$24.51,0.96,4.076%,3167734974.00,United States,2020,379493,Health Care,Major Pharmaceuticals
LEGO,Legato Merger Corp. Common stock,$9.71,0.00,0.00%,,United States,2021,502459,,
LEGOU,Legato Merger Corp. Units,$10.30,0.11,1.079%,0.00,United States,2021,693598,Finance,Business Services
LEGOW,Legato Merger Corp. Warrant,$0.6499,0.1299,24.981%,,United States,2021,820858,,
LESL,Leslie's Inc. Common Stock,$22.51,1.58,7.549%,4206518906.00,United States,2020,1477071,Consumer Services,Other Specialty Stores
LEVL,Level One Bancorp Inc. Common Stock,$23.69,0.69,3.00%,180844248.00,United States,2018,188216,Finance,Major Banks
LEVLP,Level One Bancorp Inc. Depositary Shares Each Representing a 1/100th Interest in a Share of 7.50% Non-Cumulative Perpetual Preferred Stock Series B,$26.15,0.00,0.00%,0.00,United States,,100,Finance,Major Banks
LEXX,Lexaria Bioscience Corp. Common Stock,$5.45,0.0045,0.083%,27818609.00,Canada,,128220,Health Care,Major Pharmaceuticals
LEXXW,Lexaria Bioscience Corp. Warrant,$1.99,-0.01,-0.50%,0.00,Canada,,7001,Health Care,Major Pharmaceuticals
LFMD,LifeMD Inc. Common Stock,$15.96,1.48,10.221%,408242484.00,United States,,1194645,Health Care,Medical/Nursing Services
LFTR,Lefteris Acquisition Corp. Class A Common Stock,$10.34,0.33,3.297%,267675385.00,United States,2020,632811,Finance,Business Services
LFTRU,Lefteris Acquisition Corp. Unit,$10.54,0.13,1.249%,0.00,United States,2020,22943,Finance,Business Services
LFTRW,Lefteris Acquisition Corp. Warrant,$1.60,0.30,23.077%,0.00,United States,2020,144900,Finance,Business Services
LFUS,Littelfuse Inc. Common Stock,$257.29,5.68,2.257%,6313231505.00,United States,,152476,Consumer Durables,Electrical Products
LFVN,Lifevantage Corporation Common Stock (Delaware),$9.47,0.25,2.711%,134157550.00,United States,,84115,Health Care,Major Pharmaceuticals
LGACU,Lazard Growth Acquisition Corp. I Units,$10.05,0.04,0.40%,0.00,,2021,1454419,Finance,Business Services
LGHL,Lion Group Holding Ltd. American Depositary Share,$2.80,0.15,5.66%,54517817.00,China,,2729746,Finance,Investment Bankers/Brokers/Service
LGHLW,Lion Group Holding Ltd. Warrant,$0.43,0.0022,0.514%,0.00,China,,172658,Finance,Investment Bankers/Brokers/Service
LGIH,LGI Homes Inc. Common Stock,$125.14,3.42,2.81%,3126442824.00,United States,2013,588033,Capital Goods,Homebuilding
LGND,Ligand Pharmaceuticals Incorporated Common Stock,$144.40,2.69,1.898%,2398833737.00,United States,,360236,Health Care,Major Pharmaceuticals
LGVN,Longeveron Inc. Class A Common Stock,$6.83,-0.17,-2.429%,127768202.00,United States,2021,256010,Health Care,Major Pharmaceuticals
LHAA,Lerer Hippeau Acquisition Corp. Class A Common Stock,$10.02,0.02,0.20%,0.00,United States,,2884739,,
LHCG,LHC Group Common Stock,$177.01,3.89,2.247%,5592512884.00,United States,2005,260311,Health Care,Medical/Nursing Services
LHDX,Lucira Health Inc. Common Stock,$12.00,-1.88,-13.545%,459753216.00,United States,2021,791864,Health Care,Biotechnology: In Vitro & In Vivo Diagnostic Substances
LI,Li Auto Inc. American Depositary Shares,$22.46,0.14,0.627%,20159964721.00,China,2020,24114008,Capital Goods,Auto Manufacturing
LIFE,aTyr Pharma Inc. Common Stock,$4.22,-0.22,-4.955%,42982633.00,United States,2015,537950,Health Care,Biotechnology: Biological Products (No Diagnostic Substances)
LILA,Liberty Latin America Ltd. Class A Common Stock,$13.00,0.29,2.282%,3016941226.00,United States,,233825,Consumer Services,Television Services
LILAK,Liberty Latin America Ltd. Class C Common Stock,$12.98,0.325,2.568%,3012299778.00,United States,,975300,Consumer Services,Television Services
LINC,Lincoln Educational Services Corporation Common Stock,$5.87,-0.07,-1.178%,155416051.00,United States,2005,162284,Consumer Services,Other Consumer Services
LIND,Lindblad Expeditions Holdings Inc. Common Stock,$19.38,-0.95,-4.673%,966581105.00,United States,2013,789095,Consumer Services,Transportation Services
LIQT,LiqTech International Inc. Common Stock,$9.73,-0.30,-2.991%,210707636.00,Denmark,,117105,Technology,Industrial Machinery/Components
LITE,Lumentum Holdings Inc. Common Stock,$86.11,0.79,0.926%,6518527000.00,United States,,1248933,Capital Goods,Telecommunications Equipment
LIVE,Live Ventures Incorporated Common Stock,$24.33,-0.27,-1.098%,37837408.00,United States,,16606,Consumer Services,Other Specialty Stores
LIVK,LIV Capital Acquisition Corp. Class A Ordinary Shares,$9.94,-0.01,-0.101%,100717050.00,Mexico,2020,53847,Finance,Business Services
LIVKW,LIV Capital Acquisition Corp. Warrant,$0.95,0.1499,18.735%,0.00,Mexico,2020,4109,Finance,Business Services
LIVN,LivaNova PLC Ordinary Shares,$82.41,2.81,3.53%,4004830725.00,United Kingdom,,697892,Health Care,Biotechnology: Electromedical & Electrotherapeutic Apparatus
LIVX,LiveXLive Media Inc. Common Stock,$3.80,-0.02,-0.524%,286818593.00,United States,,980786,Consumer Services,Restaurants
LIXT,Lixte Biotechnology Holdings Inc. Common Stock,$3.71,0.11,3.056%,45908660.00,United States,,162550,Health Care,Major Pharmaceuticals
LIXTW,Lixte Biotechnology Holdings Inc. Warrants,$0.8872,0.0372,4.376%,0.00,United States,,10079,Health Care,Major Pharmaceuticals
LIZI,LIZHI INC. American Depositary Shares,$7.27,0.67,10.152%,335400621.00,China,2020,1711538,Technology,Computer Software: Programming Data Processing
LJAQ,LightJump Acquisition Corporation Common Stock,$9.80,-0.05,-0.508%,0.00,United States,2021,13983,Finance,Business Services
LJAQU,LightJump Acquisition Corporation Unit,$10.09,-0.04,-0.395%,0.00,United States,2021,81984,Finance,Business Services
LJAQW,LightJump Acquisition Corporation Warrant,$0.77,-0.0101,-1.295%,0.00,United States,2021,55945,Finance,Business Services
LJPC,La Jolla Pharmaceutical Company Common Stock,$4.68,-0.07,-1.474%,128143993.00,United States,1994,284050,Health Care,Biotechnology: Biological Products (No Diagnostic Substances)
LKCO,Luokung Technology Corp Ordinary Shares,$1.00,-0.13,-11.504%,317846766.00,China,,24981550,Technology,EDP Services
LKFN,Lakeland Financial Corporation Common Stock,$72.48,2.82,4.048%,1832980713.00,United States,,173171,Finance,Major Banks
LKQ,LKQ Corporation Common Stock,$41.96,1.91,4.769%,12726989940.00,United States,,2418503,Consumer Services,Motor Vehicles
LLIT,Lianluo Smart Limited Class A Common Stock,$8.15,1.28,18.632%,3667060.00,China,,436256,Consumer Services,Other Specialty Stores
LLNW,Limelight Networks Inc. Common Stock,$3.05,0.01,0.329%,378611793.00,United States,2007,6005909,Miscellaneous,Business Services
LMACU,Liberty Media Acquisition Corporation Unit,$11.40,0.20,1.786%,0.00,United States,2021,735574,Finance,Business Services
LMAOU,LMF Acquisition Opportunities Inc. Unit,$10.27,0.15,1.482%,0.00,United States,2021,234324,Finance,Business Services
LMAT,LeMaitre Vascular Inc. Common Stock,$46.79,-0.03,-0.064%,951801478.00,United States,2006,126795,Health Care,Medical/Dental Instruments
LMB,Limbach Holdings Inc. Common Stock,$11.53,-0.02,-0.173%,114698353.00,United States,,140215,Basic Industries,Engineering & Construction
LMFA,LM Funding America Inc. Common Stock,$1.26,0.06,5.00%,33419987.00,United States,2015,1989656,Finance,Finance: Consumer Services
LMNL,Liminal BioSciences Inc. Common Shares,$4.2001,0.1901,4.741%,123423908.00,Canada,,437934,Health Care,Major Pharmaceuticals
LMNR,Limoneira Co Common Stock,$16.90,1.06,6.692%,299125217.00,United States,,137013,Consumer Non-Durables,Farming/Seeds/Milling
LMNX,Luminex Corporation Common Stock,$32.23,0.09,0.28%,1504764199.00,United States,2000,561567,Health Care,Medical/Dental Instruments
LMPX,LMP Automotive Holdings Inc. Common Stock,$17.89,1.59,9.755%,177172774.00,United States,2019,265009,Consumer Durables,Automotive Aftermarket
LMRK,Landmark Infrastructure Partners LP Common Units,$12.44,-0.21,-1.66%,317083060.00,United States,2014,72692,Consumer Services,Real Estate
LMRKN,Landmark Infrastructure Partners LP 7% Series C Fltg/Fxd Perpetual Conv Preferred Stock,$26.25,0.05,0.191%,0.00,United States,,5935,Consumer Services,Real Estate
LMRKO,Landmark Infrastructure Partners LP Perpetual Preferred Units Series B 7.90%,$25.2558,0.0653,0.259%,0.00,United States,,5465,Consumer Services,Real Estate
LMRKP,Landmark Infrastructure Partners LP 8.00% Series A Cumulative Redeemable Perpetual Preferred Units,$25.41,-0.10,-0.392%,0.00,United States,,1987,Consumer Services,Real Estate
LMST,Limestone Bancorp Inc. Common Stock,$16.61,0.79,4.994%,124577608.00,United States,,11852,Finance,Major Banks
LNDC,Landec Corporation Common Stock (DE),$11.115,0.045,0.407%,325926846.00,United States,1996,95719,Consumer Non-Durables,Packaged Foods
LNSR,LENSAR Inc. Common Stock,$8.46,0.19,2.297%,90004409.00,United States,,37826,Health Care,Medical/Dental Instruments
LNT,Alliant Energy Corporation Common Stock,$48.39,1.19,2.521%,12091744010.00,United States,,1595656,Public Utilities,Power Generation
LNTH,Lantheus Holdings Inc. Common Stock,$19.06,0.58,3.139%,1276417361.00,United States,2015,655664,Health Care,Biotechnology: In Vitro & In Vivo Diagnostic Substances
LOAC,Longevity Acquisition Corporation Ordinary Shares,$11.65,-0.21,-1.771%,30602476.00,China,2018,41971,Finance,Business Services
LOACR,Longevity Acquisition Corporation Right,$1.14,-0.02,-1.724%,0.00,China,2018,1918,Finance,Business Services
LOACU,Longevity Acquisition Corporation Units,$14.33,-0.11,-0.762%,0.00,China,2018,120,Finance,Business Services
LOACW,Longevity Acquisition Corporation Warrant,$1.16,0.02,1.754%,0.00,China,2018,41437,Finance,Business Services
LOAN,Manhattan Bridge Capital Inc,$5.22,-0.13,-2.43%,50216113.00,United States,,43043,Consumer Services,Real Estate Investment Trusts
LOB,Live Oak Bancshares Inc. Common Stock,$52.94,-0.30,-0.563%,2261983527.00,United States,2015,355809,Finance,Major Banks
LOCO,El Pollo Loco Holdings Inc. Common Stock,$19.56,0.51,2.677%,712898156.00,United States,2014,236552,Consumer Services,Restaurants
LOGC,LogicBio Therapeutics Inc. Common Stock,$7.64,-0.20,-2.551%,242848753.00,United States,2018,213145,Health Care,Biotechnology: Biological Products (No Diagnostic Substances)
LOGI,Logitech International S.A. Ordinary Shares,$95.19,0.79,0.837%,16079621022.00,United States,1997,2159163,Technology,Computer peripheral equipment
LOOP,Loop Industries Inc. Common Stock,$8.44,0.12,1.442%,357971552.00,Canada,,222551,Basic Industries,Major Chemicals
LOPE,Grand Canyon Education Inc. Common Stock,$101.35,0.49,0.486%,4750652738.00,United States,2008,399506,Consumer Services,Other Consumer Services
LORL,Loral Space and Communications Inc. Common Stock,$43.05,0.42,0.985%,1331654931.00,United States,,277509,Technology,Radio And Television Broadcasting And Communications Equipment
LOTZ,CarLotz Inc. Class A Common Stock,$7.89,-0.29,-3.545%,896425056.00,United States,2019,6974150,Consumer Durables,Automotive Aftermarket
