Symbol,Name,Last Sale,Net Change,% Change,Market Cap,Country,IPO Year,Volume,Sector,Industry
AACG,ATA Creativity Global American Depositary Shares,$4.08,-0.18,-4.225%,127910044.00,China,,177211,Consumer Services,Other Consumer Services
AACQ,Artius Acquisition Inc. Class A Common Stock,$10.66,0.37,3.596%,965396250.00,United States,2020,3468597,Finance,Business Services
AACQU,Artius Acquisition Inc. Unit ,$11.34,0.55,5.097%,0.00,United States,2020,19441,Finance,Business Services
AACQW,Artius Acquisition Inc Warrant,$1.90,0.11,6.145%,0.00,United States,2020,970698,Finance,Business Services
AAL,American Airlines Group Inc. Common Stock,$20.45,-0.79,-3.719%,13081370110.00,United States,,63064742,Transportation,Air Freight/Delivery Services
AAME,Atlantic American Corporation Common Stock,$3.67,0.02,0.548%,74920404.00,United States,,103370,Finance,Life Insurance
AAOI,Applied Optoelectronics Inc. Common Stock,$8.045,0.055,0.688%,214798708.00,United States,2013,1237373,Technology,Semiconductors
AAON,AAON Inc. Common Stock,$72.80,0.73,1.013%,3806496221.00,United States,,329255,Capital Goods,Industrial Machinery/Components
AAPL,Apple Inc. Common Stock,$121.42,1.29,1.074%,2105099822800.00,United States,1980,153581404,Technology,Computer Manufacturing
AAWW,Atlas Air Worldwide Holdings NEW Common Stock,$57.65,2.51,4.552%,1660190115.00,United States,,518773,Transportation,Transportation Services
ABCB,Ameris Bancorp Common Stock,$50.35,0.49,0.983%,3505315291.00,United States,1994,538778,Finance,Major Banks
ABCL,AbCellera Biologics Inc. Common Shares,$28.61,-1.44,-4.792%,7701462042.00,Canada,2020,1792557,Health Care,Major Pharmaceuticals
ABCM,Abcam plc American Depositary Shares,$21.11,-0.02,-0.095%,4786056012.00,United Kingdom,2020,127610,Health Care,Biotechnology: Biological Products (No Diagnostic Substances)
ABEO,Abeona Therapeutics Inc. Common Stock,$2.01,-0.07,-3.365%,193224673.00,United States,,3917222,Health Care,Major Pharmaceuticals
ABGI,ABG Acquisition Corp. I Class A Ordinary Shares,$9.97,-0.02,-0.20%,197351664.00,United States,2021,450204,Finance,Business Services
ABIO,ARCA biopharma Inc. Common Stock,$4.12,0.14,3.518%,38404456.00,United States,,1929993,Health Care,Biotechnology: In Vitro & In Vivo Diagnostic Substances
ABMD,ABIOMED Inc. Common Stock,$301.22,5.59,1.891%,13624471579.00,United States,,411897,Health Care,Medical/Dental Instruments
ABNB,Airbnb Inc. Class A Common Stock,$179.81,-0.42,-0.233%,107238505449.00,United States,2020,8775547,Finance,Diversified Commercial Services
ABST,Absolute Software Corporation Common Stock,$13.85,-0.28,-1.982%,680267084.00,Canada,2020,149548,Technology,Computer Software: Prepackaged Software
ABTX,Allegiance Bancshares Inc. Common Stock,$39.69,0.55,1.405%,811561672.00,United States,2015,162603,Finance,Major Banks
ABUS,Arbutus Biopharma Corporation Common Stock,$3.30,0.16,5.096%,280200551.00,Canada,,3753266,Health Care,Major Pharmaceuticals
ACAC,Acies Acquisition Corp. Class A Ordinary Share,$10.18,0.17,1.698%,273905625.00,United States,2020,961055,Finance,Business Services
ACACU,Acies Acquisition Corp. Unit,$10.75,0.15,1.415%,0.00,United States,2020,159338,Finance,Business Services
ACACW,Acies Acquisition Corp. Warrant,$1.69,-0.21,-11.053%,0.00,United States,2020,153421,Finance,Business Services
ACAD,ACADIA Pharmaceuticals Inc. Common Stock,$48.98,3.16,6.897%,7839125081.00,United States,2004,1718434,Health Care,Major Pharmaceuticals
ACAHU,Atlantic Coastal Acquisition Corp. Unit,$9.99,0.04,0.402%,0.00,United States,2021,3507858,Finance,Business Services
ACBI,Atlantic Capital Bancshares Inc. Common Stock,$22.87,1.18,5.44%,466431637.00,United States,,103134,Finance,Major Banks
ACCD,Accolade Inc. Common Stock,$39.92,0.85,2.176%,2208421466.00,United States,2020,1693445,,
ACER,Acer Therapeutics Inc. Common Stock (DE),$2.87,0.02,0.702%,41070400.00,United States,,211171,Health Care,Major Pharmaceuticals
ACET,Adicet Bio Inc. Common Stock ,$13.70,-0.09,-0.653%,268380644.00,United States,2018,144032,Health Care,Major Pharmaceuticals
ACEV,ACE Convergence Acquisition Corp. Class A Ordinary Shares,$10.58,0.38,3.725%,304175000.00,United States,2020,865187,Technology,Semiconductors
ACEVU,ACE Convergence Acquisition Corp. Unit,$11.68,0.18,1.565%,0.00,United States,2020,18357,Technology,Semiconductors
ACEVW,ACE Convergence Acquisition Corp. Warrant,$2.25,0.152,7.245%,0.00,United States,2020,239660,Technology,Semiconductors
ACGL,Arch Capital Group Ltd. Common Stock,$36.37,0.67,1.877%,14657637911.00,Bermuda,,4405511,Finance,Property-Casualty Insurers
ACGLO,Arch Capital Group Ltd. Depositary Shares Each Representing 1/1000th Interest in a Share of 5.45% Non-Cumulative Preferred Shares Series F,$25.72,0.09,0.351%,0.00,Bermuda,,12682,Finance,Property-Casualty Insurers
ACGLP,Arch Capital Group Ltd. Depositary Shares Representing Interest in 5.25% Non-Cumulative Preferred Series E Shrs,$25.32,0.03,0.119%,0.00,Bermuda,,20971,Finance,Property-Casualty Insurers
ACHC,Acadia Healthcare Company Inc. Common Stock,$54.98,0.68,1.252%,4895416231.00,United States,,652371,Health Care,Medical Specialities
ACHV,Achieve Life Sciences Inc. Common Shares,$10.59,0.15,1.437%,64494837.00,United States,,235838,Health Care,Biotechnology: In Vitro & In Vivo Diagnostic Substances
ACIU,AC Immune SA Common Stock,$7.43,0.10,1.364%,533037748.00,Switzerland,2016,375977,Health Care,Major Pharmaceuticals
ACIW,ACI Worldwide Inc. Common Stock,$38.29,1.43,3.88%,4485388508.00,United States,,617506,Technology,Computer Software: Prepackaged Software
ACKIT,Ackrell SPAC Partners I Co. Subunits,$9.90,-0.0001,-0.001%,0.00,United States,2021,35366,Finance,Business Services
ACKIU,Ackrell SPAC Partners I Co. Units,$10.35,0.20,1.97%,0.00,United States,2020,27700,Finance,Business Services
ACKIW,Ackrell SPAC Partners I Co. Warrants,$0.82,0.11,15.493%,0.00,United States,2021,128283,Finance,Business Services
ACLS,Axcelis Technologies Inc. Common Stock,$37.20,1.42,3.969%,1254833711.00,United States,2000,424056,Technology,Industrial Machinery/Components
ACMR,ACM Research Inc. Class A Common Stock,$88.10,1.40,1.615%,1647408242.00,United States,2017,357663,Technology,Industrial Machinery/Components
ACNB,ACNB Corporation Common Stock,$31.26,1.85,6.29%,272065564.00,United States,,27451,Finance,Major Banks
ACOR,Acorda Therapeutics Inc. Common Stock,$5.22,-1.56,-23.009%,49502492.00,United States,2006,1020000,Health Care,Biotechnology: Biological Products (No Diagnostic Substances)
ACRS,Aclaris Therapeutics Inc. Common Stock,$21.31,0.17,0.804%,1103948738.00,United States,2015,605875,Health Care,Major Pharmaceuticals
ACRX,AcelRx Pharmaceuticals Inc. Common Stock,$1.74,0.04,2.353%,198031046.00,United States,2011,3231449,Health Care,Major Pharmaceuticals
ACST,Acasti Pharma Inc. Class A Common Stock,$0.6304,0.07,12.491%,61081055.00,Canada,,27370803,Health Care,Major Pharmaceuticals
ACTC,ArcLight Clean Transition Corp. Class A Ordinary Shares,$16.61,-0.14,-0.836%,576159375.00,United States,2020,4112105,Capital Goods,Auto Manufacturing
ACTCU,ArcLight Clean Transition Corp. Unit,$19.00,-0.12,-0.628%,0.00,United States,2020,22404,Capital Goods,Auto Manufacturing
ACTCW,ArcLight Clean Transition Corp. Warrant,$5.00,0.26,5.485%,0.00,United States,2020,938973,Capital Goods,Auto Manufacturing
ACTG,Acacia Research Corporation (Acacia Tech) Common Stock,$6.52,0.09,1.40%,321302034.00,United States,,1208279,Miscellaneous,Multi-Sector Companies
ADAG,Adagene Inc. American Depositary Shares,$23.11,0.12,0.522%,974775640.00,China,2021,70563,Health Care,Major Pharmaceuticals
ADAP,Adaptimmune Therapeutics plc American Depositary Shares,$5.13,0.12,2.395%,795857658.00,United Kingdom,2015,1310517,Health Care,Biotechnology: Biological Products (No Diagnostic Substances)
ADBE,Adobe Inc. Common Stock,$440.83,1.77,0.403%,211025321000.00,United States,1986,4614501,Technology,Computer Software: Prepackaged Software
ADERU,26 Capital Acquisition Corp. Unit,$10.23,0.13,1.287%,0.00,United States,2021,823340,Finance,Business Services
ADES,Advanced Emissions Solutions Inc. Common Stock,$5.80,0.01,0.173%,107577745.00,United States,,243568,Basic Industries,Major Chemicals
ADI,Analog Devices Inc. Common Stock,$148.88,4.36,3.017%,54996802311.00,United States,,4040113,Technology,Semiconductors
ADIL,Adial Pharmaceuticals Inc Common Stock,$2.13,-0.03,-1.389%,32233460.00,United States,2018,518523,Health Care,Major Pharmaceuticals
ADILW,Adial Pharmaceuticals Inc Warrant,$0.5825,-0.0676,-10.398%,0.00,United States,2018,1878,Health Care,Major Pharmaceuticals
ADMA,ADMA Biologics Inc Common Stock,$2.09,-0.14,-6.278%,197605429.00,United States,,3980238,Health Care,Biotechnology: Biological Products (No Diagnostic Substances)
ADMP,Adamis Pharmaceuticals Corporation Common Stock,$0.8845,-0.0195,-2.157%,124076996.00,United States,,5971327,Health Care,Major Pharmaceuticals
ADMS,Adamas Pharmaceuticals Inc. Common Stock,$4.74,0.04,0.851%,213031816.00,United States,2014,550135,Health Care,Major Pharmaceuticals
ADN,Advent Technologies Holdings Inc. Class A Common Stock,$12.64,-0.90,-6.647%,258338949.00,United States,2018,584778,Miscellaneous,Industrial Machinery/Components
ADNWW,Advent Technologies Holdings Inc. Warrant,$1.83,-0.15,-7.576%,0.00,United States,2018,525496,Miscellaneous,Industrial Machinery/Components
ADOC,Edoc Acquisition Corp. Class A Ordinary Share,$10.06,0.05,0.50%,118748240.00,United States,2020,19940,Finance,Business Services
ADOCR,Edoc Acquisition Corp. Right,$0.40,-0.025,-5.882%,0.00,United States,2020,20150,Finance,Business Services
ADOCW,Edoc Acquisition Corp. Warrant,$0.55,0.13,30.952%,0.00,United States,2020,129281,Finance,Business Services
ADP,Automatic Data Processing Inc. Common Stock,$178.26,7.25,4.24%,76284623617.00,United States,,2535877,Technology,EDP Services
ADPT,Adaptive Biotechnologies Corporation Common Stock,$42.23,-1.45,-3.32%,5879239612.00,United States,2019,2114597,Health Care,Biotechnology: Biological Products (No Diagnostic Substances)
ADSK,Autodesk Inc. Common Stock,$267.39,1.95,0.735%,58796227468.00,United States,,1835520,Technology,Computer Software: Prepackaged Software
ADTN,ADTRAN Inc. Common Stock,$16.525,0.315,1.943%,798778196.00,United States,1994,343783,Public Utilities,Telecommunications Equipment
ADTX,ADiTx Therapeutics Inc. Common Stock,$2.54,-0.27,-9.609%,35563551.00,United States,2020,767661,Health Care,Major Pharmaceuticals
ADUS,Addus HomeCare Corporation Common Stock,$93.83,0.82,0.882%,1483331072.00,United States,2009,117852,Health Care,Medical/Nursing Services
ADV,Advantage Solutions Inc. Class A Common Stock,$9.13,0.16,1.784%,2861571912.00,United States,2019,1085103,Miscellaneous,Business Services
ADVM,Adverum Biotechnologies Inc. Common Stock,$11.12,0.16,1.46%,1087492943.00,United States,2014,1203506,Health Care,Biotechnology: Biological Products (No Diagnostic Substances)
ADVWW,Advantage Solutions Inc. Warrant,$1.68,-0.07,-4.00%,0.00,United States,2019,25092,Miscellaneous,Business Services
ADXN,Addex Therapeutics Ltd American Depositary Shares,$10.54,0.17,1.639%,59406792.00,Switzerland,,47396,Health Care,Major Pharmaceuticals
ADXS,Advaxis Inc. Common Stock,$0.6801,-0.0252,-3.573%,76151945.00,United States,,11293138,Health Care,Major Pharmaceuticals
AEACU,Authentic Equity Acquisition Corp. Unit,$10.05,-0.01,-0.099%,0.00,United States,2021,153903,Finance,Business Services
AEGN,Aegion Corp Common Stock,$26.00,0.21,0.814%,795753374.00,United States,,239344,Basic Industries,Water Supply
AEHL,Antelope Enterprise Holdings Limited Common Stock (0.024 par),$2.67,0.13,5.118%,9869004.00,China,,587561,Capital Goods,Building Materials
AEHR,Aehr Test Systems Common Stock,$2.45,0.10,4.255%,57554244.00,United States,1997,391333,Capital Goods,Electrical Products
AEI,Alset EHome International Inc. Common Stock,$10.26,-0.39,-3.662%,87928200.00,United States,2020,5669676,Finance,Real Estate
AEIS,Advanced Energy Industries Inc. Common Stock,$102.20,2.21,2.21%,3914267767.00,United States,1995,240376,Capital Goods,Industrial Machinery/Components
AEMD,Aethlon Medical Inc. Common Stock,$1.91,-0.02,-1.036%,23155931.00,United States,,322003,Health Care,Medical/Dental Instruments
AEP,American Electric Power Company Inc. Common Stock,$78.90,1.65,2.136%,39182070907.00,United States,,4182766,Public Utilities,Electric Utilities: Central
AEPPL,American Electric Power Company Inc. Corporate Unit,$46.92,0.69,1.493%,0.00,United States,,35571,Public Utilities,Electric Utilities: Central
AEPPZ,American Electric Power Company Inc. Corporate Units,$46.68,1.09,2.391%,0.00,United States,,113854,Public Utilities,Electric Utilities: Central
AERI,Aerie Pharmaceuticals Inc. Common Stock,$18.75,-0.50,-2.597%,879696244.00,United States,2013,729251,Health Care,Biotechnology: Biological Products (No Diagnostic Substances)
AESE,Allied Esports Entertainment Inc. Common Stock,$2.44,-0.83,-25.382%,95500385.00,United States,2017,16214405,Consumer Services,Services-Misc. Amusement & Recreation
AEY,ADDvantage Technologies Group Inc. Common Stock,$2.67,-0.15,-5.319%,33018803.00,United States,,197103,Consumer Services,Office Equipment/Supplies/Services
AEYE,AudioEye Inc. Common Stock,$27.55,0.88,3.30%,283390155.00,United States,,204866,Technology,Computer Software: Prepackaged Software
AEZS,Aeterna Zentaris Inc. Common Stock,$0.92,-0.02,-2.128%,57664324.00,Canada,,9210592,Health Care,Major Pharmaceuticals
AFBI,Affinity Bancshares Inc. Common Stock (MD),$11.21,0.10,0.90%,0.00,United States,2017,9915,Finance,Savings Institutions
AFIB,Acutus Medical Inc. Common Stock,$17.00,-0.81,-4.548%,473383411.00,United States,2020,831101,Health Care,Medical/Dental Instruments
AFIN,American Finance Trust Inc. Class A Common Stock,$9.90,0.20,2.062%,1077488369.00,United States,,645582,Consumer Services,Real Estate Investment Trusts
AFINO,American Finance Trust Inc. 7.375% Series C Cumulative Redeemable Preferred Stock,$25.01,-0.09,-0.359%,,United States,,41734,Consumer Services,Real Estate Investment Trusts
AFINP,American Finance Trust Inc. 7.50% Series A Cumulative Redeemable Perpetual Preferred Stock,$25.50,0.03,0.118%,0.00,United States,,29857,Consumer Services,Real Estate Investment Trusts
AFMD,Affimed N.V.,$5.22,0.09,1.754%,599184705.00,Germany,2014,2040690,Health Care,Major Pharmaceuticals
AFRM,Affirm Holdings Inc. Class A Common Stock,$81.14,-3.32,-3.931%,20886040574.00,United States,2021,5374528,Miscellaneous,Business Services
AFYA,Afya Limited Class A Common Shares,$22.41,0.17,0.764%,2088675263.00,Brazil,2019,130397,Consumer Services,Other Consumer Services
AGBA,AGBA Acquisition Limited Ordinary Share,$10.53,0.03,0.286%,62916750.00,Hong Kong,2019,7694,Finance,Business Services
AGBAR,AGBA Acquisition Limited Right,$0.3314,-0.0186,-5.314%,0.00,Hong Kong,2019,7746,Finance,Business Services
AGBAU,AGBA Acquisition Limited Unit,$11.40,0.00,0.00%,0.00,Hong Kong,2019,1,Finance,Business Services
AGBAW,AGBA Acquisition Limited Warrant,$0.3424,-0.0176,-4.889%,0.00,Hong Kong,2019,63222,Finance,Business Services
AGC,Altimeter Growth Corp. Class A Ordinary Shares,$11.52,0.22,1.947%,720000000.00,United States,2020,282748,Finance,Business Services
AGCUU,Altimeter Growth Corp. Unit,$12.04,0.23,1.948%,0.00,United States,2020,97478,Finance,Business Services
AGCWW,Altimeter Growth Corp. Warrant,$3.07,0.45,17.176%,0.00,United States,2020,63319,Finance,Business Services
AGEN,Agenus Inc. Common Stock,$3.20,0.04,1.266%,608477763.00,United States,2000,4953917,Health Care,Biotechnology: Biological Products (No Diagnostic Substances)
AGFS,AgroFresh Solutions Inc. Common Stock,$2.42,0.06,2.542%,128393003.00,United States,2014,127534,Basic Industries,Agricultural Chemicals
AGFY,Agrify Corporation Common Stock,$12.90,1.34,11.592%,247958227.00,United States,2021,1617705,Consumer Non-Durables,Farming/Seeds/Milling
AGIO,Agios Pharmaceuticals Inc. Common Stock,$48.89,1.56,3.296%,3402809121.00,United States,2013,1258612,Health Care,Major Pharmaceuticals
AGLE,Aeglea BioTherapeutics Inc. Common Stock,$7.25,0.10,1.399%,347544026.00,United States,2016,241466,Health Care,Major Pharmaceuticals
AGMH,AGM Group Holdings Inc. Class A Ordinary Shares,$15.62,0.07,0.45%,451278279.00,Hong Kong,2018,1033,Technology,EDP Services
AGNC,AGNC Investment Corp. Common Stock,$15.90,-0.015,-0.094%,8552606868.00,United States,2008,13886887,Consumer Services,Real Estate Investment Trusts
AGNCM,AGNC Investment Corp. Depositary Shares rep 6.875% Series D Fixed-to-Floating Cumulative Redeemable Preferred Stock,$25.05,0.07,0.28%,0.00,United States,,15052,Consumer Services,Real Estate Investment Trusts
AGNCN,AGNC Investment Corp. Depositary Shares Each Representing a 1/1000th Interest in a Share of 7.00% Series C Fixed-To-Floating Rate Cumulative Redeemable Preferred Stock,$25.38,0.01,0.039%,0.00,United States,,13268,Consumer Services,Real Estate Investment Trusts
AGNCO,AGNC Investment Corp. Depositary Shares each representing a 1/1000th interest in a share of 6.50% Series E Fixed-to-Floating Cumulative Redeemable Preferred Stock,$24.72,0.20,0.816%,0.00,United States,,27798,Consumer Services,Real Estate Investment Trusts
AGNCP,AGNC Investment Corp. Depositary Shares Each Representing a 1/1000th Interest in a Share of 6.125% Series F Fixed-to-Floating Rate Cumulative Redeemable Preferred Stock,$23.65,-0.025,-0.106%,0.00,United States,,24025,Consumer Services,Real Estate Investment Trusts
AGRX,Agile Therapeutics Inc. Common Stock,$2.23,0.00,0.00%,195348000.00,United States,2014,1890902,Health Care,Major Pharmaceuticals
AGTC,Applied Genetic Technologies Corporation Common Stock,$4.88,-0.18,-3.557%,208170445.00,United States,2014,2888258,Health Care,Biotechnology: Biological Products (No Diagnostic Substances)
AGYS,Agilysys Inc. Common Stock,$54.15,2.11,4.055%,1279973441.00,United States,,344379,Technology,EDP Services
AHAC,Alpha Healthcare Acquisition Corp. Class A Common Stock,$10.79,0.39,3.75%,165680450.00,United States,2020,2158748,Finance,Business Services
AHACU,Alpha Healthcare Acquisition Corp. Unit,$12.03,0.69,6.085%,0.00,United States,2020,10824,Finance,Business Services
AHACW,Alpha Healthcare Acquisition Corp. Warrant,$2.57,0.27,11.739%,0.00,United States,2020,307133,Finance,Business Services
AHCO,AdaptHealth Corp. Class A Common Stock,$31.14,0.06,0.193%,4038499205.00,United States,2018,1392357,Health Care,Medical/Nursing Services
AHPI,Allied Healthcare Products Inc. Common Stock,$4.46,0.22,5.189%,17900375.00,United States,1992,425009,Health Care,Industrial Specialties
AIH,Aesthetic Medical International Holdings Group Ltd. American Depositary Shares,$6.62,0.38,6.09%,156317332.00,China,2019,71897,Health Care,Medical Specialities
AIHS,Senmiao Technology Limited Common Stock,$1.23,0.09,7.895%,53331346.00,China,2018,1730778,Finance,Finance: Consumer Services
AIKI,AIkido Pharma Inc. Common Stock,$1.06,0.05,4.95%,94155715.00,United States,,11614665,Health Care,Biotechnology: Commercial Physical & Biological Resarch
AIMC,Altra Industrial Motion Corp. Common Stock,$61.74,3.43,5.882%,4001199800.00,United States,2006,338148,Capital Goods,Industrial Machinery/Components
AINV,Apollo Investment Corporation Common Stock,$14.00,0.00,0.00%,913628464.00,United States,2004,399862,,
AIRG,Airgain Inc. Common Stock,$20.35,-0.65,-3.095%,210660616.00,United States,2016,241289,Technology,Radio And Television Broadcasting And Communications Equipment
AIRT,Air T Inc. Common Stock,$24.10,-1.73,-6.698%,69452657.00,United States,,24381,Transportation,Air Freight/Delivery Services
AIRTP,Air T Inc. Air T Funding Alpha Income Trust Preferred Securities,$25.00,-0.10,-0.398%,0.00,United States,,2617,Transportation,Air Freight/Delivery Services
AIRTW,Air T Inc. Air T Funding Warrants to Purchase Alpha Income Trust Preferred Expiring 08/30/2021,$0.245,0.005,2.083%,0.00,United States,,62590,Transportation,Air Freight/Delivery Services
AKAM,Akamai Technologies Inc. Common Stock,$97.13,3.69,3.949%,15853584825.00,United States,1999,3620530,Miscellaneous,Business Services
AKBA,Akebia Therapeutics Inc. Common Stock,$3.405,0.085,2.56%,522675791.00,United States,2014,6651895,Health Care,Major Pharmaceuticals
AKER,Akers Biosciences Inc. Common Stock,$2.75,0.11,4.167%,51220953.00,United States,2014,536260,Health Care,Biotechnology: In Vitro & In Vivo Diagnostic Substances
AKIC,Sports Ventures Acquisition Corp. Class A Ordinary Shares,$9.802,-0.078,-0.789%,288276820.00,United States,2021,2089,Finance,Business Services
AKICU,Sports Ventures Acquisition Corp. Unit,$10.12,0.04,0.397%,0.00,United States,2021,322734,Finance,Business Services
AKICW,Sports Ventures Acquisition Corp. Warrant,$0.99,0.09,10.00%,0.00,United States,2021,52841,Finance,Business Services
AKRO,Akero Therapeutics Inc. Common Stock,$30.55,0.55,1.833%,1060752365.00,United States,2019,374482,Health Care,Major Pharmaceuticals
AKTS,Akoustis Technologies Inc. Common Stock,$12.26,-0.54,-4.219%,579202539.00,United States,,1982738,Public Utilities,Telecommunications Equipment
AKTX,Akari Therapeutics plc ADR (0.01 USD),$2.80,-0.13,-4.437%,107725293.00,United Kingdom,,121895,Health Care,Major Pharmaceuticals
AKU,Akumin Inc. Common Shares,$3.58,0.06,1.705%,251238772.00,Canada,,190862,Health Care,Medical Specialities
AKUS,Akouos Inc. Common Stock,$17.33,-1.42,-7.573%,595851584.00,United States,2020,547803,Health Care,Major Pharmaceuticals
ALAC,Alberton Acquisition Corporation Ordinary Shares,$10.80,0.18,1.695%,49844570.00,Hong Kong,2018,66359,Basic Industries,Engineering & Construction
ALACR,Alberton Acquisition Corporation Rights exp April 26 2021,$0.55,0.0587,11.948%,0.00,Hong Kong,2018,49333,Basic Industries,Engineering & Construction
ALACW,Alberton Acquisition Corporation Warrant,$0.6499,0.1049,19.248%,0.00,Hong Kong,2018,336178,Basic Industries,Engineering & Construction
ALBO,Albireo Pharma Inc. Common Stock,$34.85,0.98,2.893%,666109065.00,United States,,216145,Health Care,Major Pharmaceuticals
ALCO,Alico Inc. Common Stock,$30.10,0.97,3.33%,226153731.00,United States,,56148,Consumer Non-Durables,Farming/Seeds/Milling
ALDX,Aldeyra Therapeutics Inc. Common Stock,$11.18,0.01,0.09%,510506225.00,United States,2014,1233434,Health Care,Major Pharmaceuticals
ALEC,Alector Inc. Common Stock,$17.07,0.82,5.046%,1358506425.00,United States,2019,1038240,Health Care,Biotechnology: Biological Products (No Diagnostic Substances)
ALGM,Allegro MicroSystems Inc. Common Stock,$25.63,0.18,0.707%,4855186859.00,United States,2020,819767,Technology,Semiconductors
ALGN,Align Technology Inc. Common Stock,$536.46,16.01,3.076%,42451540581.00,United States,2001,953403,Health Care,Industrial Specialties
ALGS,Aligos Therapeutics Inc. Common Stock,$22.41,0.87,4.039%,854222363.00,United States,2020,54281,Health Care,Biotechnology: Biological Products (No Diagnostic Substances)
ALGT,Allegiant Travel Company Common Stock,$244.07,0.04,0.016%,4004106250.00,United States,2006,178460,Transportation,Air Freight/Delivery Services
ALIM,Alimera Sciences Inc. Common Stock,$7.32,-0.34,-4.439%,41865766.00,United States,2010,51778,Health Care,Major Pharmaceuticals
ALJJ,ALJ Regional Holdings Inc. Common Stock,$1.31,0.02,1.55%,55440573.00,United States,,365627,Miscellaneous,Business Services
ALKS,Alkermes plc Ordinary Shares,$19.28,1.07,5.876%,3070106500.00,Ireland,1991,1528921,Health Care,Major Pharmaceuticals
ALLK,Allakos Inc. Common Stock,$123.73,10.59,9.36%,6572217634.00,United States,2018,519300,Health Care,Major Pharmaceuticals
ALLO,Allogene Therapeutics Inc. Common Stock,$34.00,1.57,4.841%,4782025812.00,United States,2018,967332,Health Care,Biotechnology: Biological Products (No Diagnostic Substances)
ALLT,Allot Ltd. Ordinary Shares,$14.30,-0.02,-0.14%,503538879.00,Israel,2006,180267,Technology,Computer Communications Equipment
ALNA,Allena Pharmaceuticals Inc. Common Stock,$1.47,-0.03,-2.00%,73868897.00,United States,2017,1260273,Health Care,Biotechnology: Biological Products (No Diagnostic Substances)
ALNY,Alnylam Pharmaceuticals Inc. Common Stock,$143.39,6.02,4.382%,16776919504.00,United States,2004,491344,Health Care,Major Pharmaceuticals
ALOT,AstroNova Inc. Common Stock,$11.50,0.00,0.00%,82460589.00,United States,1983,22133,Technology,Computer peripheral equipment
ALPN,Alpine Immune Sciences Inc. Common Stock,$12.95,-0.03,-0.231%,308251220.00,United States,2015,232050,Health Care,Major Pharmaceuticals
ALRM,Alarm.com Holdings Inc. Common Stock,$86.64,1.92,2.266%,4296199399.00,United States,2015,361415,Technology,Computer Software: Prepackaged Software
ALRN,Aileron Therapeutics Inc. Common Stock,$1.36,-0.01,-0.73%,113709805.00,United States,2017,2099820,Health Care,Major Pharmaceuticals
ALRS,Alerus Financial Corporation Common Stock,$30.31,1.31,4.517%,519066934.00,United States,2019,32216,Finance,Major Banks
ALSK,Alaska Communications Systems Group Inc. Common Stock,$3.29,-0.03,-0.904%,177998725.00,United States,1999,251196,Public Utilities,Telecommunications Equipment
ALT,Altimmune Inc. Common Stock,$12.94,-0.24,-1.821%,480725865.00,United States,,1756755,Health Care,Major Pharmaceuticals
ALTA,Altabancorp Common Stock,$36.72,1.60,4.556%,690461509.00,United States,2015,38582,Finance,Major Banks
ALTM,Altus Midstream Company Class A Common Stock,$53.87,-0.09,-0.167%,875196800.00,United States,2017,43642,Public Utilities,Natural Gas Distribution
ALTO,Alto Ingredients Inc. Common Stock,$6.33,-0.23,-3.506%,457794278.00,United States,,4699270,Basic Industries,Major Chemicals
ALTR,Altair Engineering Inc. Class A Common Stock,$58.44,-0.23,-0.392%,4359520678.00,United States,2017,546865,Technology,Computer Software: Prepackaged Software
ALTU,Altitude Acquisition Corp. Class A Common Stock,$10.65,0.12,1.14%,399375000.00,United States,2021,2205274,Finance,Business Services
ALTUU,Altitude Acquisition Corp. Unit,$11.73,0.41,3.622%,0.00,United States,2020,117439,Finance,Business Services
ALTUW,Altitude Acquisition Corp. Warrant,$2.10,0.01,0.478%,0.00,United States,2021,1084894,Finance,Business Services
